Two Layer Stainless Steel Bento Box Lunchbox and Carrying Case,B004RKMQBA
Asuberu Lantus BS stainless thermal insulation lunch HLB-B500 (with bag) PG 3143 (japan import),B008XVFG98
Luntus Lunch Box (TLB-T600) (Green),B071VPDT3R
Asvel Forma Yoji- Ire,B078P7VYWC
Asvel MG-S330 SP Vacuum Mug Cup (Black),B00Q9WTLGM
Luntus Vacuum Soup Bottle -L(SR380) (Blue),B07H51R1ZG
ASVEL 2Pcs The Unbreakable Wooden Man Magic Toy| Fun Toy Stage Magic Prop Christmas Party Velcro,B08196SM6D
ASVEL 2PC 360° Rotatable ABS Faucet Spray Head Tap| Splash Filter Nozzle| 3 Modes Adjustment,B07T3KKG2F
Chopstick Storage Container Box by Asvel,B0018NIOS8
ASVEL Stainless insulation lunch box with bag 「LUNTUSWS WS」HLB-W490S(Pearl Pink),B00Q9WU0UI
Rice Dispenser 13.2lbs by Asvel,B0092K0B3U
Rice Storage Bin with Pour Spout by Asvel 2kg (2 PACK),B074Q2KC6S
Asuberu forma Hood 22 S-WHT (japan import),B0030OB8OK
Healthy Oil Pot/Bottle 140ml (S) (Pack of 2),B0716XB29H
Pose Drainer Vat,B079577JD7
Asvel HLB-W800N Luntus WS Vacuum Lunch Box,B071YTSVNR
Rabbit SS-T620 and Lantus month (with bag) 3152 (japan import),B01LWHL75S
Asvel Forma Deep Tray (2pcs),B071HVNL7Q
ASVEL Waste Sorting Recycling Bin with Wheels (Wide),B0018NMAFG
Asvel LB-550LV BP Lunch Box,B071DXVYQ4
ASVEL 25 Packs Practice Golf Balls Plastic Airflow Hollow 5 inch Wiffle Golf Balls for Driving Range| Swing Training| Indoor/Outdoor Use,B07SZ6HMV5
asuberu rantasu Stainless Steel Heat Preservation| Cold Soup Bottle,B01M1BWRSM
Honey Uncapping Fork Scraper Knife Food Degree New Designed Stainless Steel Honey Uncapping Tool,B07RNCDZ9D
Asvel Luntus Vacuum Soup Bottle -L(SR380) (Pink),B071F7VNYH
asuberu SP Sensible Dust Box Pedal 2 Tier Wide 40l,B00TY2PLMM
Asbel C Lantus SS-T570C Ivory 3642,B06VVGV5SK
Asvel Pose Dust Corner Pot (2 Pcs),B071VSZBN5
ASVEL Unix Small Measuring Rice Bin 12KG,B01N9PS1MQ
C Lantus SA-500 3635,B01ABQCIFC
Asvel SP Pose Drainer (M) Brown,B071F5B8VY
ASVEL Home Versatile Tool Design Drawing Curved Metallic Ruler Mini Compass Protractor Combo Patterns for Notepad Designers Artists Architects Student,B07RZQ76KW
Rice Storage Bin with Pour Spout by Asvel,B013RQCYLQ
Asvel LB-240LV Vive Lunch Box,B074835XKZ
Rice Storage Bin with Pour Spout by Asvel 2kg (5 PACK),B074Q3D6SC
ASVEL Asuberu Lantus WS Stainless Thermal Insulation Lunch HLB-W490 (with Bag) PG 3144 (Japan Import),B008XVFIO6
Soy Sauce Pot with stainless Steel Cap. Model: 2247 (Home & Kitchen),B01149WC2O
Asvel Luntus WS Lunch Box | HLB-W490 (Pink),B008XVFII2
Asvel Luntus Dot/ Line Lunch Box (SS-T480) YELLOW,B0716XH7R6
ASVEL|Manual Ceramics Salt And Pepper Grinder MIll From Japan|Black,B016ZKXTDS
Asvel LB-T870 Lunch Box N Dear Label,B072BRW35W
ASVEL HDS008 N Aus Towel Hanger (4pcs),B071F34CPK
Asvel Rice Dispenser 26.5 lb Capacity by UNIXWARE,B01M0PLUDX
ASVEL Stainless insulation lunch box With bag「LUNTUSWS」HLB-W800N (Metallic Gray),B00Q9WUG1G
ASVEL Asuberu Lantus BS Stainless Thermal Insulation Lunch HLB-B500 (with Bag) PP 3143 (Japan Import),B008XVFG9I
Asvel Eban Pedal Pail 20,B0725JJ8FM
Asvel Forma Shoyu-Shashi (Large),B072F7FTX1
Asbel Sp Stainless Steel Vacuum Insulation Mug 11 Fl Oz (Black),B00O1H0FEY
Asvel VIO 2000 Ice Tea Pitcher 2.0L (2 Pieces),B071S7JFJP
Pose Scrubber Rack (White) (2pcs),B072BWV28B
ASVEL M Wagon Wide 3 Steps 43L dust Box,B00MTJYAMO
Asbel Drink Biot 2.0L D-201,B0018NHA2E
C Lantus SS-T480 3633,B01ABQCATQ
ASVEL Emeal Soap Tray (4pc) (Pink),B072BBM65W
ASVEL drawer for rice bin 6kg W,B002TUYD1G
ASVEL 5 Pack All-Round Protection Hat with Clear Wide Visor Lightweight Transparent Shield with Adjustable Elastic Band,B087CMBCYD
Asvel Heatproof Measuring Cup R200,B0714CJR8L
Asvel BP Vive Lunch Box (LB-350) White,B0714BQQX6
ASVEL Bento Lunchbox with Moveable Divider - Holds 490 Ml (Approx. 16.25 Oz)| Microwave and Freezer-Safe| Leak-Proof Seal,B01N0ACK09
Asbel Emeal soap dish pink 5636 (japan import),B00G68JZS8
Hemp Oil for Pain & Stress Relief| Ecofinest 100% Natural Hemp Seed Extract Rich in Vitamin & Omega -Helps with Sleep| Skin & Hair| Zero THC CBD Cannabidiol(1 Pack 1000MG),B018IL26YA
Soy Sauce Dispenser Bottle,B001FBI668
Asvel Pose Drainer Slim (Blue),B0725QBCT7
C Lantus SS-T480 3633,B01ABQCET2
C Lantus SS-T480 3633,B01ABQCQ2C
Bento Box Style 2 Layer Lunchbox by Asvel,B00AJ83HWG
Asvel Vacuum Tumbler (TL370) White,B079FPSD23
Bento Lunchbox with Moveable Divider - Holds 490 Ml (Approx. 16.25 Oz)| Microwave and Freezer-safe| Leak-proof Seal,B005X0K5XY
ASVEL Stainless insulation lunch box with bag 「LUNTUSWS WS」HLB-W490S (Pink Gold),B00P8RW51W
Asvel Luntus BS Lunch Box | HLB-B620 (White),B00FR4A572
asuberu SP Handle with Dust Box 45 6726 ,B00FAZVFUE
Asvel Forma HG Oil Spray,B009CPLVLQ
Lantus soup bottle (M) HLB-SR300 Champagne Gold (japan import),B00EEQB366
Soy Sauce Dripless Dispenser Pot,B003OA41UI
Rice Storage Bin with Pour Spout by Asvel 2kg ('10' PACK),B0756PDDG5
asuberu C rantasu,B06VVGTYZQ
Asbel Lantus stainless steel insulated bottle soup HLB-S280 G 3146 (japan import),B008XVFKSA
ASVEL HDS009 N Aus Towel Hanger (4pcs),B07145PQBP
asuberu C rantasu,B01ABQCAUK
Asvel HLB-S280 Luntus Hot & Cold Bottle 280ml/9.5oz (Navy Blue),B079FBDJK3
Asvel VIO Drink Pitcher D-210 (2.1L) (2 Pieces),B071S7HQHN
Asvel O-500LV BP Vive Lunch Box| White,B0711DKPYC
Asvel MG-T240 Vacuum Mug Cup,B014215MM8
asuberu SP Handle with Dust Box 70 6727 ,B00FAZVI24
Lunchbox with Chopsticks in the Lid #3110,B001PV2U7Y
Asvel SS-T600 Lunch Box F Deli Club w/ Bag (Pink),B07147YKK4
Asvel Vacuum Tumbler (TL370) Gold,B079FPSD3Q
Asvel Unix Circle Pot (Large) (2 Pieces),B071P246N3
Asvel Pose Corner Sink Strainer (2pcs),B071HVP61Z
Rice Storage Bin with Pour Spout by Asvel 2kg (4 PACK),B074Q2PBXL
Asvel Pose Drainer (M) (Blue),B0711S1PPR
Asvel OA-830 LV BP Lunch Box| White,B071L3ZVZN
Asvel Dish Drainer w/Tray,B0722YR5S3
ASVEL Takoyaki Oil Brush with Container,B0058F395A
Asvel Unixware Jumbo OJ-75(7.6L) (3pcs),B0711S12FZ
ASVEL N forma stainless 3 1121 (japan import),B001O2XSSE
Asvel VIO Ice Tea Pitcher D-221 (2 Pieces),B071LGG3QQ
Red pot deep Wazarenji master glass oven cooking early (japan import),B001FT0GDG
C Lantus SS-T600 3632,B01ABQCMBW
Asbel C Lantus SS-T570C Pink 3642,B06WD3RWCT
Asvel Luntus BS Vacuum Lunch Box | HLB-B1040,B008XVFG8O
Asbel cold water cylinder 2.2L Drink Biot white D-221,B003I4K8F2
Asvel Sesame Grinder (Red) (2 Pieces),B071LGHR9P
asuberu Sensible dasutobokkusupakkin with Pedal 2 Tier Slim 38l,B00WW3TS38
Asvel Airtight Rice Stocker (12KG),B07B9NZT95
Asvel HLB-S280 Luntus Hot & Cold Bottle 280ml/9.5oz (Ivory),B079F64F61
Asvel Tooth Brush Head Replacement Pack (5pcs),B0722J2TQH
ASVEL Waste Sorting Recycling Bin with Wheels (Wide),B0011EVWZ6
Asvel Wall Mirror (2pcs),B0725HY4DP
ASVEL SOAP Dispenser N550 Green,B00XKJ9ADG
Asbel C Lantus SS-T570 Ivory 3641,B06VVGTYTW
asuberu Kitchen Box Will,B0018NIOKG
Asvel Lunch Box LB-900,B0711QY4HH
ASVEL drawer for rice bin 12kg W,B002TV66ME
ASVEL Lantus SS-T480 Yellow 3136 (Japan Import),B007FLKZBQ
Dripless Glass Soy Sauce Dispenser Pot with Black Cap by Asvel,B01AHFNKO0
Asvel Luntus TW Vacuum Lunch Box (T820) Black,B0716X5PY7
Asbel water pitcher D-162T Drink Biot,B004XLGCD6
asuberu Resources Garbage Horizontal 3 piles Wagon Each 20l Beige/Yellow/Brown 6706 ,B008B5QP2S
Asvel HLB-SR250 Luntus Vacuum Soup Bottle 250ml/4.22oz (Ivory),B079FKVJSK
Asbel C Lantus SS-T570C Navy 3642,B06X6GM9WS
Asvel MG-S330 SP Vacuum Mug Cup (Red),B00OAX0ZXU
ASVEL Oil Bottle and Brush,B01N2143ZY
Asbel Lantus TW Stainless Thermal Insulation Lunch Box HLB-T820 (with Bag) Black 3212 (Japan Import),B00FR4A8MY
ASVEL N Wagon Wide 3 Steps 43L dust Box　White/Yellow/Broen,B075M9FSVJ
C Lantus SS-T600 3632,B01ABQCF1E
LUNTUS travel soup thermos 12.8oz,B07GZ37P94
Asbel sorting dust box pedal 2 step wide 40L,B00WW3UG7A
Asvel Luntus Vacuum Soup Bottle -M(SR-300) (Gold),B071HTKHVB
Asvel MG-S330 SP Vacuum Mug Cup (White),B00OAX10KC
C Lantus SS-T480 3633,B01ABQCMB2
Japanese Style Bento Box Lunchbox with Chopsticks,B001NLV1EO
Asvel Luntus Hot & Cold Keep Soup Bottle (SR380) (Pink),B0714BGXNS
Asvel Pose Bowl 21 Grey (5pcs),B0716YFN4Y
Asvel Mini Grater (2 Pieces),B0714CMMTF
ASVEL Able Dust Box Medium (x2),B0794LFQRR
Asvel Pose Drainer Vat,B071F38WKD
ASVEL One push soy sauce glass cruet dispenser jar flacon soja 80ml SUSHI White,B078YT5ZHJ
Asbel BP Beebe OA-650 (avec partition) (Japon import / Le paquet et le manuel sont ?crites en japonais),B005PS2W9O
ASVEL Pedal Slim 38L with Separation dust Box Packing　Red,B00TY2PF5U
Asvel Unixware Earthenware R-30 880ML,B0728B33M7
ASVEL Ruclaire LTH.Print D. Bin S.,B072F974DJ
Asvel SP Pose Drainer Vat (Brown),B008FJ94XM
Asbel C Lantus SS-T570 Navy 3641,B06VV6QK4P
Asvel Luntus Vacuum Soup Bottle (M) (SR-300),B079FBHX4S
EVAN asuberu pe-ru,B005J0WQ76
ASVEL Discrimination dust Box Pedal 2 Steps Wide 40L　Brown,B00VR93YTW
Asbel water pitcher S1100 Drink Biot Pink,B00HRKC95A
Asvel Unixware Earthenware R-10 270ML (Pack of 3),B071VSVDV2
Asvel Vat Kitchen Tray White (3 Pcs),B07234JRHZ
Asvel VIO Water Cooler D-162T| Cold Tea Pot (1.6L) (2 Pieces),B0714CLS99
Asvel Vio Water Jug S1100 (2 Pieces) (Blue),B07289R6YK
1 X Soy Sauce Pot with stainless Steel Cap. by Azvel,B000K9VJ74
Rice Storage Bin with Pour Spout by Asvel 2kg ('3' PACK),B0756S1PRL
Asbel Lantus Cafe Bowl Warm Bag Navy for Lunch HLB-CD500,B0757C5RRV
Oil Bottle and Brush,B00FFT8VVQ
Asvel SP Pose Washing Pan 35 (Brown) (Pack of 5),B071LBNNS1
Asvel Vat Kitchen Tray Grey (3 Pcs),B071S7LFJ3
C Lantus SS-T600 3632,B01ABQCM9Y
ASVEL HG7504 Rice Dispensers (6KG),B07B9NT81S
asuberu C rantasu,B01ABQCEOW
Asbel Forma Moulin en c?ramique (de sel gemme| Pices Pour) W (Japon importation),B001NY4QCK
ASVEL 8 Colors/Set Gift Card Writing Drawing Pens Double Line Outline Pen Stationery,B081C38GCH
Secretary White double Egret mini glass Spice jar-ASVEL 680ML,B008KU6TCU
Asvel Unix Circle Pot (Medium) (2 Pieces),B0728B34L5
Asvel Unix S Measure Rice Stocker 12KG,B07B9FLR81
Asvel Bell-One Chop Board Holder,B071P19W5X
C Lantus SS-T620 3634,B01ABQCIKC
Secretary ORANGE double Egret mini glass Spice jar-ASVEL 680ML,B008KU6RSG
Asvel Luntus Hot & Cold keep soup Bottle (S280) (Pink),B07288WT7B
SecretaryGREEN double Egret mini glass Spice jar-ASVEL 680ML,B008KU6RAY
Black Dear Label Bento Box Set - Made in Japan,B0047IGRYE
Forma ceramic mill for sesame BK (japan import),B001NY2TUG
ASVEL Posay Silicium BOL G 4939 (Japon Import/Le paquet et le Manuel sont ?crites en japonais,B004LQ12ME
Asbel Lantus stainless steel insulated bottle soup HLB-S280 SG 3146 (japan import),B008XVFKNA
Asvel MG-T300 SP Vacuum Mug Cup (Black),B071VJS34J
ASVEL Pedal Slim 38L with Separation dust Box Packing　Black,B00TY2PLMC
asuberu SP Sensible Dust Box Pedal 2 Tier Wide Brown White 6802 ,B00TY2PF7S
asuberu C rantasu,B01ABQCFAK
Asvel Luntus Hot & Cold Keep Soup Bottle (SR380) (Gold),B0716X624W
Asvel HLB-B1040N Luntus BS Vacuum Lunch Box,B072F3XYQ5
Asvel VIO Water Cooler 210T| Cold Tea Pot (2.1L) (2 Pieces),B0714CKKZF
Lantus soup bottle (L) HLB-S380 Pink (japan import),B00EEQB5ZK
Asvel horizontal recycling bins (3) set on a rolling wagon,B0011F204W
Secretary BROWN double Egret mini glass Spice jar-ASVEL 680ML,B008KU6SBM
Asvel TL290 Vacuum Tumbler Black,B014216088
Asvel Luntus WS Vacuum Lunch Box | HLB-W800,B00G68K654
Asvel Vio Water Jug S1100 (2 Pieces) (Pink),B0728B43DQ
Rice Storage Bin with Pour Spout by Asvel 2kg ('5' PACK),B0756RXP5L
Rice Storage Bin with Pour Spout by Asvel 2kg (3 PACK),B074Q28SYD
ASVEL Lantus Soup Bottle (L) HLB-S380 Champagne Gold (Japan Import,B00EEQB5WS
Asvel Unixware Earthenware Bowl 400ML (Pack of 2),B07289QFNS
Asvel HLB-SR380 Luntus Vacuum Soup Bottle 380ml/12.8oz (Ivory),B07H515BB8
Asvel Drainer W/Tray 200 x 360 x 20mm,B079FDBFRW
asuberu C rantasu,B01ABQCAUA
Asvel Oil Brush With Holder,B0723CV8DJ
Healthy Oil Pot/Bottle 200ml (L) (Pack of 2),B0719HTTJ2
Unix glass oven cooking saucepan Orange 4549 (japan import),B005PSH460
Asvel LL Club ALB-TS1000,B0714BLS5H
Asvel Unixware Jumbo O-55 (4pcs),B0711RXZ2R
Rice Storage Bin with Pour Spout by Asvel 2kg ('4' PACK),B0756PGQB3
Asbel C Lantus SS-T830 Ivory 3640,B06X18ZFB8
Asvel MG-T300 SP Vacuum Mug Cup (White),B0725G6CJ2
Asbel Lantus stainless steel insulated bottle soup HLB-S280 P 3146 (japan import),B008XVFKWQ
Asvel Garbage Containers| Separating Type| Includes Pedal| 2-tier| Slim| 10.0 gal (38 L),B00VR940MC
1 X New Asvell Plastic Sesame Grinder Made In Japan,B001TV66W0
Asvel SS-T600 Lunch Box F Deli Club with Bag (Green),B072BS7NNY
Charging Stand For Hyperice Hypervolt- Available for All the Accessories Charging At the Same Time (Comptible with Both Hyperice Hypervolt),B07T1GKC2G
Asvel BP Lunch Box (LB-950LV),B07288YTK2
ASVEL Discrimination dust Box Pedal 2 Steps Wide 40L　Black,B00TY2PF5A
Asvel VIO Ice Tea Pitcher D-201 (2 Pieces),B0711RYKJ1
Luntus Lunch Box (TLB-T600) (Pink),B07286JTY2
ASVEL SP Vacuum Insulation Mug MG-T330 Black 3246,B00OAX0UL2
Small Lunch Box with 3 compartments #3939,B003MCDB72
Asvel Luntus Lunch Box (SS-T480. W/BAG),B071Z7457X
Asvel Unix Circle Pot (Small) (3 Pieces),B072FGLYTV
Asvel N Pose Mixing Pot 24 (3 Pieces),B0716YDFY4
asuberu SP Handle with Dust Box 45 6726 ,B00FAZVI42
asuberu SP Handle with Dust Box 70 6727 ,B00FAZVI2E
Asbel C Lantus SS-T570 Green 3641,B06VVGV2M5
Asvel VIO Drink Pitcher D-162 (1.6L) (2 Pieces),B071Z85NYJ
Japanese Style Bento Box Lunchbox with Chopsticks,B00GCHY1L4
ASVEL Secretary RED Double Egret Mini Glass Spice jar 680ML,B0090BA0A0
ASVEL Japanese Style Lunchbox Large 9 by 6#3447,B007FLL7E0
Asbel Lantus FL SS-T640 P 3228 (Japon import / Le paquet et le manuel sont ?crites en japonais),B00H9606P2
Rice Storage Bin with Pour Spout by Asvel 2kg ('2' PACK),B0756RVNKK
Asvel Luntus BS Lunch Box | HLB-B620 (Pink),B00F3U7NKM
Asvel HLB-SR380 Luntus Vacuum Soup Bottle 380ml/12.8oz (Blue),B079F5R3FJ
Lantus soup bottle (L) HLB-SR380 Champagne Gold (japan import),B00EEQB5RI
Asbel Pozebatto N (grand) Blanc (japon importation),B005X18EJA
Asvel Luntus TW Lunch Box | HLB-T550N (Pink),B00IIY0FH8
