Samior JJ022 Mini Small Front Flipper Pocket Folding Knife| 1.57 Inch D2 Cleaver Blade| Grey Titanium Handle| Micro Tiny Keychain Necklace EDC Gentlemen's Knives,B085L4K8ZZ
Samior HA013 Mini Flipper Knife|1.57 inch 9Cr18mov Damascus Blade| Anodized Titanium Handles with Frame Lock| Small Micro Folding Pocket EDC Keychain Knives| Watercolor,B07PPW5KKT
Samior FB808 3.5 Medium Gurkha Kukri Hand Forged Satin Black Blade Folding Pocket Knife| Wenge Wood Handle with Dual Bolsters LockBack EDC Utility Knives| 4.9 oz,B07FZL61K5
Samior Flashleaf Minimalist Compact Fixed Blade Knife| 2.16 Cleaver Blade with Lighting Pattern| Wood Pattern G10 Handle with Finger Choil| Small Utility Camping Hunting Knife with Kydex Sheath,B07R5BCP7S
Samior DTK16 Mini Small Folding Pocket Little Bowie Knife 1.6 Inch D2 Razor Sharp Nick Nail Cleaver Blade| Flat TC4 Titanium Frame Lock Handle| Small Compact EDC Keychain Gentlemen's Knives| 1oz,B07L5R197X
Samior 5933 Mini Slip Joint Keychain EDC Folding Pocket Knife| 2.1 inch Drop Point Blade| Skeleton Style Handle for Utility Box Opening Rope Cut Knives,B07YRDQ9PZ
Samior Bisha SD32 Folding Flipper Knife| 3.2 inch Razor Sharp Damascus Cleaver Blade Butcher Knives| Contoured PVD Stonewashed Steel Handle with Frame Lock| Camping Hunting Tactical Knives,B07H6ZHPTJ
Samior CDT20 Small Killer Compact Folding Pocket Cleaver Knife| 2 inch D2 Blade with Dual Thumb Studs| Rosewood Handle with Liner Lock| Gift Collection EDC Micro Chopping Knives,B07GD2ZB7Q
Samior Flashleaf Minimalist Compact Fixed Blade Knife| 2.16 9CR18MOV Cleaver Blade with Lighting Pattern| Blue Red Honeycomb Resin Handle with Large Finger Choil| Small Utility Camping Hunting Knife,B07R694N7T
Samior FC28 Friction Cleaver Folding Pocket EDC knife,B08LG8CVFX
Samior AC513 Little Fang Mini Bowie Slipjoint Keychain Knife| 2 inches Satin Clip Point Nick Nail Blade Small Folding Pocket Knives| Flame Pattern Acrylic Handle Dual Steel Bolsters Handle| 1.6 oz,B07GZTHL1N
Samior Flashleaf Small Compact Fixed Blade Knife| 2.16 Cleaver Blade with Lighting Pattern| Jade Color Resin Handle with Finger Choil| Utility Camping Hunting Knife with Kydex Sheath,B07R78S1M1
Samior Big Shark S327 Custom Folding Flipper Knife| 3.27 Razor Sharp Axe-Style Cleaver Blade| Stainless Steel Gold Handle w/Frame Lock| Blue Back Spacer| Pocket Clip| Tactical Camping Hunting Knives,B07R5DN2T7
Samior GF374 Tactical Knife| 3.74 Inch Stonewashed Blade with Thumb Groove Open| Black G10 Handle with Liner lock| TC4 Titanium Pocket Clip| Camping Hunting Outdoor Fishing Knives,B0829GDKTJ
Samior HA011 Micro Folding Pocket Flipper Cleaver Knife| 1.25 Inche Damascus Blade| Blue Anodized Titanium Handle| Thumb Hole| Frame Lock| Necklace| Keychain EDC Mini Knives| 0.85 oz,B07N1Y55K6
Samior HY002 Ultra Small Little Folding Pocket Flipper Knife| 1.3” VG10 Damascus Blade| Gray Anodized Titanium Handle with Frame Lock| Mini EDC Keychain Gift Collection Pendant Necklace Knives| 0.9oz,B07GCY4JRZ
Samior FDT15 Mini Folding Pocket Flipper Knife| 1.45 inch D2 Clip Point Blade with Thumb Hole| Anodized Titanium Handle with Frame Lock| Micro Little Small Keychain Necklace Pendant Knives| Grey,B07K5N7YV7
Samior ST386 Compact Slim Samurai Katana Style Folding Pocket Flipper Knife| 3.86 inch D2 Plain Tanto Blade| Black Slender Non-Slip G10 Handle Liner Lock| Tactical Camping Hunting EDC Knives,B0829CP8SR
Samior HY007 Custom Made Mini Front Flipper Folder| 1.85” D2 Stonewashed Reverse Tanto Small Folding Pocket Chisel Pry EDC Knife| Rainbow Anodized Skeletonized Frame Lock Titanium Handle 1.4oz,B07GZY1B6T
Samior Kingfisher TD-1 Front Flipper Slender Knife| 3.54 Inch D2 Slim Blade| Rainbow Anodized 6AL4V Titanium Frame Lock Holes Handle| EDC Gift Tactical Knives with Lanyard Pocket Clip Folding Knives,B07FKZ532Q
Samior Small Shark Multifunction Pocket Knife| 1.8-inch D2 Wharncliffe Blade with Stonewashed Finish| Titanium Handle| Nick Nail Open| Friction Lock| Bottle Opener| Key Ring Folding Knives| 1.16oz,B07L5S89TW
Samior Flashleaf Minimalist Compact Fixed Blade Knife| 2.16 9CR18MOV Leaf Shape Blade with Lighting Pattern| Black Red Resin Handle Finger Choil| Small Utility Camping Hunting Knife w/Kydex Sheath,B07R682F74
Samior Kingfisher TD-1 Front Flipper Folding Pocket Knife| 3.54 Inch Slim Drop Point D2 Blade| Blue Anodized Titanium Frame Lock Handle| EDC Tactical Camping Hunting Knives,B07FFG5YCD
Samior HY005 Mini Cleaver Flipper Knife| 1.5” D2 Blade Super Small Folding Pocket EDC Knives| Grey Fluted 6AL4V Titanium Handle Frame Lock| Little Key Chain Ring Tool Gift Knives,B07R49Q65P
Samior TS105 Titanium Utlitly Knife,B08MYVT6T7
Samior SMC606 Stubby Mini Cleaver Folding Knife| 1 Inch Stonewashed 5CR13 Chisel Blade| Stainless Steel Handle| Tiny Pocket Gentlemen and Girls EDC Keychain Knives,B085KY87TJ
Samior DTK16 Mini Small Folding Pocket Little Bowie Knife 1.6 Inch Damascus Razor Sharp Nick Nail Cleaver Blade| Flat TC4 Titanium Frame Lock Handle| Small Compact EDC Keychain Gentlemen's Knives| 1oz,B07GD2XS15
Samior HY003 Mini Flipper Folder Knife| 1.45 inch D2 Tanto Blade| Grey Titanium Handle with Frame Lock| Japanese Katana Style Small Keychain EDC Folding Pocket Necklace Knives,B07PPY3YWL
Samior GDD035 Small Slim Folding Pocket Flipper Knife| 3.5 Inch Damascus Drop Point Blade| Titanium Handle Frame Lock Pocket Clip| Low Profile Gentleman's EDC Knives,B07R67GGJT
Samior GDT035 Small Slim Folding Pocket Flipper Knife| 3.5 inch VG10 Damascus Tanto Blade| Slender Grey Titanium Handle Frame Lock Pocket Clip| Sleek Everyday Carry Low Profile Gentleman's Pen Knives,B07R68PB31
Samior HY006 Small Damascus Pocket Flipper Knife| 1.3 Plain Leaf-Shaped VG10 Spear Point Super Mini EDC Folding Knives| Gray Titanium Handle with Frame Lock Lanyard Necklace Keychain Necklace Knives,B07J57S2S2
Samior SF283 Compact EDC Folding Pocket Flipper Knife| 2.83 inch Black Stonewashed Wharncliffe Blade| Frame Lock| Brushed Non-slip Mosaic Stainless Steel Handle| Utility Fruit Daily Task Knives,B082RS8BGV
Samior A23 Small Leaf Pocket Slipjoint Knife| 2.16 inches Damascus Blade| Engraved Brass with Genuine Abalone Inlay Handle| Nick Nail Opening| Compact EDC Folding Keychain Ring Little Knives,B07V5RDCMF
Samior 8122 Slip Joint Keychain Blue Resin Handle,B08MYD6ZNG
Samior FB817 Folding Pocket Knife Mirror Polish 3.3 Blade| Stainless Steel Emboss Gecko Handle Backlocked| Camping Hunting Tactical Tool for Everyday Carry,B07FZJ6S33
Samior S35 Compact Folding Pocket Flipper Knife| 3.5 inch Drop Point Blade| Red Sandalwood Handle With Liner lock| Tactical Camping Hunting Utility Gentleman's EDC Knives 4oz,B08LG1731J
Samior HA013 Mini Flipper Knife|1.57 inch 9Cr18mov Damascus Blade| Anodized Titanium Handles with Frame Lock| Small Micro Folding Pocket EDC Keychain Knives|Rainbow,B07PQYX5X6
Samior HA010 Mini Necklace Folding Pocket Flipper| 1.6 9cr18mov Acid Etched Rose Damascus Blade with Thumb Hole| Frame Lock Green Ripple Anodized Titanium Handles| Small Key Ring EDC Keychain Knives,B07N1ZWMT9
Samior TS135 Titannium Utility Knife,B08MYH6LD3
Samior MOP15 Small Folding Pocket Damascus Knife| 1.7 Rainbow Sheepsfoot Thumb Stud Open Blade| Mother of Pearl Linerlock Handle with Lanyard| Compact Everyday Carry Little Collection Knives,B07L5S3S97
Samior Black-Swallow BS338 Folding Pocket Knife| 3.38 inch Damascus Slicer Blade Folder with Liner Lock| Thumb Stud Open| Lanyard| Ebony Handle| EDC Camping Hunting Fishing Folder Knives,B0829GSCB9
Samior HA012 Mini Cleaver Knife| 1.3 Inch Sheepsfoot Blade| Anodized 6AL4A Titanium Handle with Frame Lock| Folding Flipper Pocketknife| Micro Keychain Necklace EDC Gentlemen's Knives|Green,B07SXVP7SC
Samior KT2 Mini Gurkha Kukri Folding Pocket Slipjoint Knife| 2” VG10 Damascus Dogleg Blade with Seabed Bolster & Ebony Wood Handle| Small EDC Gentleman Keychain Gift Knives| 1oz,B07GD3D7S3
Samior CDT20 Small Killer Cleaver Knife| 2 inch VG10 Damascus Blade with Dual Thumb Studs| Rosewood Handle with Liner Lock| EDC Folding Pocket Chopping Utility Knives,B07L5QR1YG
Samior HA011 Small Folding Pocket Flipper Necklace Knife| 1.25” Acid Eched Damascus Mini Bowie Cleaver Blade| Anodized Titanium Frame Lock Handle| Micro Keychain Everyday Carry Utility Folder Knives,B07N1YPDRP
Samior S325 Damascus Pocket Flipper Knives,B08LF7ZHZ9
Samior GW035 Small Slim Folding Pocket Flipper Knife| 3.5 Inch D2 Satin Tanto Blade| Ebony Handle Liner lock Low Profile Gentleman's Pen Knives| Leather Sheath,B0829GMQ7Y
Samior JJ022 Mini Small Front Flipper Pocket Folding Knife| 1.57 Inch Damascus Cleaver Blade| Grey Titanium Handle| Micro Tiny Keychain Necklace EDC Gentlemen's Knives,B085KYTC9P
Samior FB03 Compact Folding Pocket Flipper Knife| 3 inch Damascus Wharncliffe Blade Plain Edge Folder with Liner Lock| Rosewood Handle with Bolsters| EDC Camping Hunting Fishing Folder Knife,B0829FFTQ8
Samior FDT15 Mini Folding Pocket Flipper Knife| 1.45 inch D2 Clip Point Blade with Thumb Hole| Anodized Titanium Handle with Frame Lock| Micro Little Small Keychain Necklace Pendant Knives| Blue,B07K5NGF8H
Samior HA013 Small Folding Pocket Necklace Knife| 1.5 9CR18MOV Acid Etched Rose Damascus Wharncliffe Thumb Hole Blade| CNC Green Purple Anodized Titanium Frame Lock Handles,B07N2CXZLD
Samior SD24 Compact Folding Pocket Knife| 2.4 Spear Point Satin Blade| Rosewood Handle with Liner Lock| Small EDC Gift Collection Utility Camping Hunting Survival Knives,B07RPH897D
Samior DTS15 Small Mini Folding Pocket Knife| 1.5 VG10 Damascus Spear Point Plain Blade| Titanium Handle| Thumb Hole| Frame Lock| Lanyard Beads| Leather Sheath| Perfect Gentleman Gift EDC Knives,B07L5SDJGL
Samior WD2 Friction Folder Small Folding Karambit Knife 2.2” D2 Satin Straight Razor Sharp Claw Wharncliffe Blade Wood Handle EDC Compact Little Pocket Gentleman Utility Christmas Gift Knives,B07GCZT1TN
Samior TD21 Small Pocket Folding Flipper Knife| 2 VG10 Damascus Slip Joint Blade TC4 Titanium Handle| Non-Locking Compact EDC Everyday Carry Keychain Little Mini Micro Utility Knives 0.9oz,B07L5QWZ34
Samior Kingfisher TD-1 Front Flipper Folding Pocket Knife| 3.54 Inch Slim Drop Point D2 Blade| Grey Anodized Titanium Frame Lock Handle| EDC Tactical Camping Hunting Knives,B07FDP6RQ6
Samior GP035-CFT Small Slim Folding Pocket Flipper EDC Knife| 3.5 inch M390 Black Stonewash Tanto Blade| Carbon Fiber Handle Liner lock| Low Profile Gentleman's Penknife| Blue Pocket Clip| 1oz,B0829FZ5MK
Samior FK5833 Small Mini Slip Joint Pocket Folding Keychain EDC Knife (2.3 Blade),B07YRDRT7J
Samior 5825 Slipjoint Keychain Knife,B08LG5HLYP
Samior 5817 Mini Slipjoint Keychain Neck Knife| 1.85” Spear Point Nick Nail Blade| Flame Pattern Acrylic Handle Dual Steel Bolsters| Little Small Folding Pockt Everyday Carry Knives| 1.6oz,B07R78RYC5
Samior BTC374 Slender Front Flipper Knife| 3.74 D2 Satin Tanto Blade| Grey Titanium Inlay Carbon Fiber Handle Frame Lock Pocket Clip| EDC Slim Gentleman's Folding Pocket Knives with Leather Sheath,B07R67KFJL
Samior CF413 Folding Tactical Flipper Knife| 4.1 inch Satin D2 Sleek Blade| Carbon Fiber Handle| Liner Lock| Pocket Clip| EDC Camping Hunting Fishing Knives,B0829GDSZL
Samior SM157 Ultra Small Mini Slipjoint Pocket Knife| 1.5 inch VG10 Damascus Drop Point Blade| Sea Bed Bolsters Rosewood Handle| Little Tiny Micro EDC Keychain Gentleman's Gift Folding Knives,B07R7BFF1S
Samior BD004 Folding Pocket Flipper Knife| 3.6 inch Drop Point Blade| Straight-up Grey 6AI4V Titanium Handle with Frame Lock Pocket Clip| Slender Sleek Utility EDC Gentleman's Knives with Sheath,B07R78T7N8
Samior 1863 Small Non-Locking Detent Slip Joint Knife Mirror Light Blade EDC Mini Pocket Folding Keychain Knives,B082BJ4QTC
Samior TD20 Small Slip Joint Pocket Folding Knife| 2 D2 Satin Blade Flat Titanium Handle| Non-Locking| Nick Nail Flipper Opening| Mini EDC Keychain Penknives,B07GCYZPWC
Samior Bisha SD32 Folding Flipper Knife| 3.2 inch Razor Sharp Damascus Tanto Blade Butcher Knives| Contoured PVD Stonewashed Steel Handle with Frame Lock| Camping Hunting Tactical Knives,B07H6ZPK11
Samior ZL101 Mini Folding Pocket Cleaver Knife| 1.75 D2 Satin Drop Point Razor Sharp Blade with Thumb Stud| Sandalwood Handle with Lanyard Hole and Liner Lock| Small EDC Utility Knives| 2.55oz,B07GCYZL2H
Samior GDT035 Small Slim Folding Pocket Flipper Knife| 3.5 inch Satin D2 Tanto Blade| Slender Grey Titanium Handle Frame Lock Pocket Clip| EDC Low Profile Gentleman's Sleek Knives,B07R68756G
Samior Small Armor Pocket Folding Knife| 2 VG10 Damascus Spear Point Leaf Shape Blade| Rosewood Steel Bolsters Handle| Thumb Open and Lock Liner| for Utility Backup and Everyday Carry Little Knives,B07R7BCT4V
Samior HA009 Mini Cleaver Knife| 1.38 Inch Damascus Blade| Rainbow Anodized Titanium Handles with Frame Lock| Micro Folding Pocket knives| Necklace EDC Flipper Knife,B07N1YYR8L
Samior BEM302 Mini Folding Pocket Flipper Knife| 1.57 inch D2 Satin Wharncliffe Plain Blade with Thumb Hole| Anodized Titanium Handles with Liner lock| Micro EDC Keychain Necklace Girls Knives| Grey,B07M59GN3H
Samior FB1314 Spring Assisted 3.54 Spear Point Satin Blade Cross Lock Pocket Folding EDC Knives Bolster Sandalwood Handle Boy Scouts Knife Tactical Survival Knife for Camping Outdoor Tactical| 5.47oz,B07FZJBYVJ
Samior TU97 Titanium Utility Knife,B08MYC3BK1
Samior WS185 Mini VG10 Damascus Pocket Knife| 1.85” Wharncliffe Folding Blade Rosewood Handle EDC Christmas Gift Knives with Thumb Stud Open Liner Lock Lanyard for Carving Cutting Box Opening| 2.55oz,B07GCY4CZ3
Samior BT004 Custom Slender Folding Pocket Flipper Knife| 3.66 Plain Tanto Slim Blade| Straighten Anodized Grey Titanium Handles Frame Lock Pocket Clip| Compact Backup EDC Gentleman's Knives,B07R7BND5P
Samior HA012 Mini Cleaver Knife| 1.3 Inch Sheepsfoot Blade| Anodized 6AL4A Titanium Handle with Frame Lock| Folding Flipper Pocketknife| Micro Keychain Necklace EDC Gentlemen's Knives|Rainbow,B07SXVZXSS
Samior GP035-CFD Small Slim Folding Pocket Flipper EDC Knife| 3.5 inch M390 Black Stonewash Drop Point Blade| Carbon Fiber Handle Liner lock| Low Profile Gentleman's Penknife| Blue Pocket Clip| 1oz,B0829DMRBF
Samior Q13 Small Little Folding Pocket Knife| 1.3” Drop Point VG10 Damascus Blade Shadow Wood Steel bolster Handles Liner Lock| Mini EDC Keychain Gift Collection Key Ring Knives| 1.6 oz,B07PT4FGK9
Samior SD374 Small Slim Folding Flipper Knife| 3.74 inch D2 Thin Blade| Slender Red Sandalwood Handle with Bolsters| Liner Lock| Low Profile Gentleman's Pocket EDC Knives,B08LG3FKWH
Samior BP267 Small Compact Keychain EDC Slip Joint Knife Penknife Folding Pocket Knife| Bamboo Pattern Stainless Steel Handle| 2.67 inch Blade,B07YRDX2YY
Samior CF36 Compact Folding Pocket Flipper Knife| 3.6 inch D2 Wharncliffe Satin Blade Plain Edge Liner Lock| Carbon Fiber Handle Lanyard Hole| EDC Pocket Clip| Camping Hunting Survival Folder Knives,B0829G6MYG
Samior Titanium Anti-lost Quick Release Men's Women's Keychain Hook| Rainbow Anodized Integral Wire Cut Love heart Key Ring Hook Bottle Opener| Valentines Day Thanksgiving Day Gift,B07QBB646X
Samior BEM302 Mini Flipper Folding Pocket Knife| 1.57 VG10 Damascus Wharncliffe Blade| Liner Lock| Gray Titanium Handle| Micro Small EDC Keychain Necklace Knives,B07M59VNZK
Samior MK177 Mini Small Karambit Flipper Knife| 1.77 Inch VG10 Damascus Hawkbill Claw Blade| Titanium Handle with Frame Lock| Lanyard Hole| Pocket Clip| Micro Folding Pocket EDC Keychain Knives,B0829F7YX8
Samior BEM302 Mini Keychain Flipper Knives| 1.57 VG10 Damascus Drop Point Blade with Thumb Hole Assisted Open| Wire Cut Purple Anodized Titanium Handles| Small Everyday Carry Folding Pocket Knife,B07M86K2PH
Samior SD374 Small Slim Folding Flipper Knife| 3.74 inch Thin VG10 Damascus Blade| 4.5 Inch Slender Red Sandalwood Handle with Bolsters| Liner Lock| Low Profile Gentleman's Pocket EDC Knives,B083HP1Z3C
Samior MG36 Small Damascus SlipJoint Pocket Knife| 3.6” Slim VG10 Clip Point Blade Sandalwood Bolster Handle EDC Folding Knives Utility Fruit Self-defense Tool Knives with Wood Gift Box| 2.7oz,B07GVM15Q1
Samior HY006 Mini Folding Pocket Flipper Knife| 1.3 inch D2 Leaf-Shaped Spear Point Blade| Anodized Titanium Handle with Frame Lock Lanyard| Super Small Micro Necklace Keychain EDC Knives| Grey,B07L5RFS9R
Samior HY003 Small Pocket Samurai Keychain Knife| 1.45 inches Mini Flipper with Razor Sharp D2 Tanto Blade Keychain EDC Folding Knives| Blue Anodized Titanium Handles with Frame Lock Necklace Lanyard,B07J9LZ4SX
Samior S157 Mini Slip Joint Pocket Knife| 1.57 Damascus Blade| Olive Wood Handle,B08CZXRQ1Y
Samior DT02 Mini Small Folding Pocket Knife| 2 Razor Sharp VG10 Damascus Wharncliffe Blade with Nick Nail| Textured TC4 Titanium Handle| Frame Lock| Micro Minimalist Design EDC Key Chain Ring Knives,B07GD1R23R
Samior Small Penguin Damascus Mini Karambit Folding Pocket Knife| 1.38 Claw VG10 Blade with Thumb Hole Open| Rosewood Handle with liner Lock and Lanyard Leather Sheath| 2.1oz,B07GD32W8V
Samior BEM302 Mini Flipper Knife| 1.57 VG10 Damascus Sheepsfoot Thumb Hole Blade| Engraved Dragonfly Wing Pattern Green Titanium Handles w/Liner Lock Lanyard| Small Pocket Folding Key Chain Knives,B07M5BBBVW
Samior TS107 Keychain Utility Knife,B08MYC3M1H
Samior HY005 Mini Cleaver Flipper Knife| 1.5” Satin D2 Sheepsfoot Blade| Blue Anodized 6AL4V Titanium Handle Frame Lock| Super Small Folding Pocket EDC Keychain Tool Little Gift Necklace Knives,B07L5PVW43
Samior Titanium Anti-lost Quick Release Men's Women's Keychain Hook| Rainbow Anodized Integral Wire Cut Deer Moose Key Ring Hook for Christmas Thanksgiving,B07QGHT3C2
Samior Small Armor Pocket Folding Knife| 2 7CR17MOV Spear Point Leaf Shape Blade| Rosewood Steel Bolsters Handle| Thumb Open and Lock Liner| for Utility Backup and Everyday Carry Little Knives,B07R49YXSR
Samior Bisha SD32 Folding Flipper Knife| 3.2 inch Razor Sharp D2 Cleaver Blade Butcher Knives| Contoured PVD Stonewashed Steel Handle with Frame Lock| Camping Hunting Tactical Knives,B07H6WTVD5
Samior WS21 Small Straight Pocket Friction Razor Knife| 2.1 Inch D2 Wharncliffe Claw Blade with Thumb Hole Slot Finger Choil| Wood Handle Folding EDC Knives with Lanyard| 4.5 oz,B07GD2PSSG
Samir SW24 Compact Folding Pocket Knife| 2.4 Sheepsfoot Razor Sharp Blade with Thumb Stud| Wooden Handle Steel Bolster| Liner Lock| Small EDC Utility Gift Knife,B07RQFMNZH
Samior HY002 Miniature Necklace Flipper Knife| 1.3” Satin D2 Drop Point Blade Rainbow Titanium Frame Lock Handle| Handmade EDC Micro Folding Pocket Knives with Lanyard Hole| Cute Gift for Girlfriend,B07L5RPGL3
