Space Invaders Anniversary [Japan Import],B00009MDCT
Ensemble Stars! Emblem metal badge vol.1 Trickstar single item (prize),B01HXXO6OW
Saikyo Shooting Collection Vol.3: Sol Divide and Dragon Blaze [Japan Import],B0006ZL2BK
Taito Re:Zero − Starting Life in Another World Rem- Overalls ver.-| Multiple Colors (T18520),B08GM52PW4
Taito lottery Honpo Fate / stay night I award deformed figure Saber single item (japan import),B00AJEBQBO
Aru Kagaku no (Railgun) Misaka Mikoto & Kuroko Shirai night figures Misaka Mikoto separately by TAITO,B00NFA24SI
Happy Meal Tomica (TOMICA) McDonald's Hitachi Construction Machinery wheel loader ZW220,B01LYW3R13
Taito 6.3 Kantai Collection: Kancolle: Urakaze Figure,B01GHGN8NQ
Taito Re: Zero -Starting Life in Another World-: Rem Precious Figure (Magician Version),B0893YX811
Taito Monogatari Series: Nadeko Sengoku Figure,B00GX34V6M
Taito Re:. Zero Emilia Rem Lamb Summer Ket 100cn Japanese ver Cute Kawaii,B08GY5QNKM
Claymore capsule collection figures all very set of 5 (japan import),B003XN353K
Taito Final Fantasy Brave Exvius Lottery Last FFBE Award 3rd Season Fina Figure (Last FFBE Version),B07Z9N6DNL
Taito Project Diva Hatsune Miku 2nd Season Spring Version 7 Figure,B07TY9G3KF
Taito Re: Life in a Different World Starting from Zero ●Precious Figure ●REM-Original Salopette Swimwear ●ver.,B08F5G7HVP
Taito Alice: 18cm Jamma Prize Statue Figurine Bundled with 1 A.C.G. Trading Card (451085400),B08GL5M86Y
Bubble Bobble: Magical Tower Daisakusen [Japan Import],B000FMLJF8
Puchi Copter 2 [Japan Import],B0009CM8HW
Re:Zero REM-Sabaru's Training Suit ver-,B08GLZYXD1
Taito Hatsune Miku Plush Doll Series Miku,B01D5V3ZE8
Taito Pocket Tomica (Tomica) P047 Toyota Alphard White,B00F4ZHKLI
Taito Their Tsukkomi Bear Cup Sleeve 5 Set Stuffed Soft Plush Doll Genuine,B084FSRX4G
Taito 7 Love| Chunibyo & Other Delusions: Rikka Takanashi Figure,B00ILPW0RM
Taito Great Writer Stray Dogs Sit Stuffed Dazai Single Item,B01N9F9331
Bubble Bobble - Nintendo NES,B00004SVNS
Taito Super Sonico Summer Beach Figure,B00E6PK3WU
Taito 8 Super Sonico Figure Along with Pochaco,B00LC25JN8
Two box Arcadia Reiji Matsumoto Super Mecha (The Movie Galaxy Express 999 version) (japan import),B0014VGKM6
Taito Final Fantasy XIV Shining Mouse & Mouse Pad Volume 2 Carbuncle,B07M9WYBHY
Hatsune Miku 10th Anniversary Kagamine Rin Lottery Taito-Kuji Drawing Acrylic Charm Award,B07C3VJ5MC
Ver smile Hatsune Miku ~ CuteRody stuffed .,B00I0UT8Z0
We are Honma Meiko & Anjo Naruko figure you do not yet know all set of 2 the name of the flower seen that day (japan import) by Taito,B0072STLI0
Taito Gloomy Bear Purple Hard Cover Case for iPhone 3G/3GS,B004V9ATCU
Hatsune Miku Senbonzakura earphone jack Metal Charm whole set of 6,B00E6P09YM
It is not Taito lottery Honpo cardboard cherry 18 species last Happy Award a total of 19 1 carton,B01BWGANZ2
Nyanbo swaying tail solar figure (gray),B01N4VTW08
Movie High speed! Free! Starting Days carabiner with stuffed Nanase much single item (prize),B01MS1SGRR
Taito Original Autumn Clothes 7 Hatsune Miku Action Figure (Renewal Version),B07YQXYXGX
Free! Aiichiro Nitori Pillow Case About 25 inch Width by Taito,B018FYBC9U
Taito lottery Key H Award mini figure strap CLANNAD Sakagami Tomoyo separately strap figure Clannad TAITO TAITO,B00MF9N1C8
Movie High speed! Free! Starting Days deformed figure vol.2 Taito (all three Furukonpu set),B01C8HU4AS
Shaun the Sheep super BIG stuffed,B011IWQM1Y
Persona 4 Arena - P4U ~ 8.5 Yukiko Amagi Figure,B00DRCN94M
Taito Go it! Anpanman mega Jumbo Bread Pouch Stuffed,B01DGNUWU0
Kantai Collection KanColle Deformed Figure Vol. 8 Tokitsukaze PVC Figure,B01MRAIU0M
Taito Cardcaptor 5 Set with Sakura Clear Card Hen Ball Chain Stuffed Soft Plush Doll Genuine,B07HMGXGLK
Taito Hatsune Miku Autumn & Winter image stuffed Soft plush 16cm Winter ver.,B0828S3DPF
Space Invaders 91,B0009W8TWA
Taito Final Fantasy All Stars Deformed Stuffed vol.1 All Two,B01L8JUEUC
Taito 2.5 Official Doraemon Plush Doll - Doraemon (Red),B006W1FAX8
Taito Final Fantasy XIV A Realm Cactuar Figure Room Lamp Light| 8.6,B01DF6KBCC
Densha de Go! Pocket: Chuuousenhen (Taito Best) [Japan Import],B000JC20KM
Taito Dragon Quest AM The Mark of Erdrick Pocket Watch 6cm 2set Gold & Silver,B07SZQNFF1
Taito Danboard Vol. 2 Big Brown Action Figure,B01MSMMJJ8
Taito Final Fantasy XIV Fat Chocobo USB Stand Light,B07F6XBTS2
Wizardry Summoner [Japan Import],B0007MSMGA
Taito Sakura Miku draw down 2020ver. Taito online crane Ver. Figure,B084ZDF4MW
Taito ted2 sit Tank top XL Premium Ted Stuffed Soft Plush Doll Genuine,B07BY5XL13
Taito 7 Kantai Collection: Kancolle: Yahagi Figure,B00WM15K9G
Taito Moomin Mofumofu Blanket 100cm Moomin White Moomin valley kawaii cute anime,B083959DBN
Taito lottery Honpo IS- Infinite Stratos E Award figure Laura Bodewig,B007Q6S2YW
Taito Hatsune Miku Senbonzakura Music Box Vermilion [ ver ],B00FHJ0BIK
Taito lottery Honpo Key F Prize desktop LCD cover God Kamikita Komari (Little Busters!),B00CFJL8Y6
Taito Splatoon 2: Curling Bomb Cleaner (Neon Green Version),B07FT8ND4J
Taito Kirby of The Stars Stained Glass-Style Blanket Flannel Fabric Kawaii Japan,B07KRV8SH7
Taito Final Fantasy XIV Fat Chocobo Alarm Clock (Yellow)| 6.3,B07F3R73RT
Taito Original Autumn Clothes 7 Hatsune Miku Action Figure (Renewal Version) (Taito Online Crane Version),B07Z6M2ZV4
Taito Fate/Extra Last Encore Nursery Rhyme PVC Figure,B07R62TYR4
Bust-A-Move,B000035Y62
Miami Vice: The Game [Japan Import],B000GBRL6E
Taito Final Fantasy XIV A Realm Spriggan Shiny Coin Bank| 7,B06XCD9GR1
Taito Magic Show Series 8 Super Sonico Action Figure with Black Top hat,B00NR8LX8A
Taito Persona 4 the Animation PVC Figure ~ 7 Chie Satonaka,B008YQNU4A
Ys IV: Mask of the Sun -a new theory- [Japan Import],B0007XQ446
Railfan: Taiwan High Speed Rail [Japan Import],B000VPIQ0U
Retro Space Invaders Game 5 Pack No Show Socks,B07GMTVK8C
Taito Original Casual Clothes 4.7 Hatsune Miku Action Figure,B07XF1Y7P9
Taito Danboard Solar Bobblehead Figure,B01N7MF205
Court Ver separately fluffy snow Miku Hatsune Miku Plush Doll 2012 (japan import),B00H0R8EV8
Taito Square Enix Dragon Quest Orange Slime Squishy Stress Ball Toy 7cm,B08GTVDNYG
Taito Re: Zero -Starting Life in Another World-: Rem Doll Crystal Figure,B07VDDBLJF
Taito Guilty Crown Premium Figure - Inori Yuzuriha,B008VQEQYQ
Taito Monogatari Series: Ougi Oshino Figure,B017C39CY2
Taito Sword Art Online PUCHIEETE Figure -Sinon-,B08C9W397Q
Ensemble Stars Deformed Figure Vol. 4 - Arashi Narukami,B06XP96VHG
Taito Re:Zero AMP Rem~Winter Maid Image ver~,B08K3HVVXR
Dissidia Final Fantasy Extra Large Moogle 20 inch Plush Toy,B01FDURA3Q
Taito 6.3 Kantai Collection: Kancolle: 1-401 Figure,B015TW51SE
Space Battleship Yamato super Mechanicsburg shiny wave motion gun Yamato,B001OFTFME
Kantai Collection Kancolle - Agano Figure 'Junbichu' ver.,B01JDXU43C
Taito Final Fantasy XIV Shiny Mouse and Mouse pad Meteor Mark ver.Japan Limited,B07649NZCB
Taito Sword Art Online Aincrad Fencer Asuna PVC Figure,B01F4YGKQE
Taito Memories Joukan [Japan Import],B0009NUOPY
Lufia & the Fortress of Doom,B0007Y66N4
Taito Final Fantasy XIV Fat Cat USB Stand Light| 3.1,B08H144MVL
Taito Queen of Blades Anne Lotte Figure,B01LWAP8RT
Limited prize multiplier cover [2013 celebration of Dengeki spring] Sword Art Online B separately (japan import),B00BVGO9AE
Taito Final Fantasy XIV Moogle Desk Clock| 6.3,B07WRHYV5K
Taito Guilty Crown Premium Quality PVC Figure ~5.5 - Ayase Shinomiya,B00ABWF1LU
Taito Re: Zero -Starting Life in Another World-: Rem Precious Figure (Original Maid Swimsuit Special Version),B07TP4GCJH
Taito 8 High School DxD NEW: Rias Gremory Bunny Girl Figure,B00KRNZ3ZM
Free! Drawn by lying pillow cover Nagisa Hazuki by Taito Corporation,B013VC1084
Target: Renegade,B000EAASO4
Bubble Bobble| Part 2,B00004SVNT
Taito Fate/Extra: Last Encore: Rin Tohsaka Figure,B07FZ4WQLJ
Taito 7 Hatsune Miku 2nd Season Autumn Version Action Figure,B07F3PC89B
Taito 7 Kantai Collection: Kancolle: Amatsukaze Figure Renewal ver.,B0866Y3KTD
Single item that you want to monitor Hatsune Miku secret police music box secret police  thee,B00M7RSEAM
Eighty-nine Terashin evening figure story series Ishin Nishio animation project Taito,B014ZAVYWS
Taito Inu x Boku SS: Karuta Roromiya Figure,B00DTLTDI2
Doraemon secret tool mini figure A Tokara really Speaker,B00RHZL6VS
Taito Monogatari Series: Kiss Shot Acerola Orion Heart Under Blade Figure,B06XQB3B7N
Gardening Mama [Japan Import],B001IDYN7O
Taito Free! -Eternal Summer-: Iwatobi Swim Club Deformed Figure Award Set of 4,B00UH9E2M6
Taito Final Fantasy XIV Grimoire Moggle Electronic Memo Pad,B07B4WY363
Dragon Quest AM Big stuffed lemon slime separately,B01MY4STIU
Indiana Jones and Last Crusade,B00004SVQM
Taito The Legend Of Zelda: Hyrule Pocket Watch (Breath Of The Wild),B06Y4MXSVM
Taito Galaxy Express 999 Super Mechanics Galaxy Super Express 999 Issue (Japan Import),B001TOC2WA
Taito lottery ensemble Stars! INSIDE embroidery emblem Charm Award Kozuki separately,B06VTTY6X2
Hatsune Miku Series Miku & Luke stuffed Hatsune Miku single item,B019V2SENM
Taito Re: Zero -Starting Life in Another World-: Rem Precious Figure (Original Winter Version) (Special Version),B0822SGJP9
Dragon Quest AM Soft Vinyl Figure Slime Tower,B01FF6WUK6
Taito Final Fantasy XIV All Stars Thea Rhythm Dissidia Y'Shtola Stuffed Plush| 7,B01M68C9CW
Taito Final Fantasy Brave Exvius Lottery A Award 3rd Season Fina Figure,B07ZPNK6WQ
Taito Final Fantasy XIV Namazuo Big Manju Type Stuffed Soft Plush Seigetsu 35cm,B07R5RD6VZ
Taito Moomin Family 18cm Plush Doll - Moominmamma,B0766726KV
Taito 6.5 Denpa Onna to Seishun Otoko: Erio Touwa Figure Ver.2,B007IS405S
Fairy Tail Figure ( Manga Anime ) Everybody Happy A Prize LUCY PVC FigureTaito Kuji,B00919723E
lovelive! Sunshine! ! Aqours earphone jack strap vol.2 10 pieces BOX,B06Y4ZCR5R
Taito lottery Honpo LeafAQUAPLUS C Award posters all two,B00HQ8X240
Taito lottery Honpo Little Busters! E Award Square mini Cushion Strap Rin Natsume,B00I229VFS
Taito Original Winter Clothes 6.2 Hatsune Miku Action Figure (Renewal Version),B083RSF65B
Devil superman Hen ~ H Award Big D magnet single item of seven Taito lottery Honpo Kinnikuman - (japan import),B00CJOCFDA
Taito Re: Zero -Starting Life in Another World-: Rem Precious Figure (Jacket and Swimsuit Version),B089QFWSZS
Taito Re: Zero -Starting Life in Another World-: Rem Precious Figure (Original Winter Version),B082B1FN1R
Taito Free! Eternal Summer Draw Down Lying Pillow Cover vol.2 Momotaro Mikoshiba Separately,B018BSMWTY
Taito Fina & Moogle: 14cm Jamma Prize Puchieete Statue Figurine Bundled with 1 A.C.G. Trading Card (451113400),B08GL1XX2L
Splatoon Big Shiny Light Blue Turquoise Squid 20 Plush Pillow,B01KBDG8W4
Taito Sword Art Online II ALfheim Online Undine Asuna PVC,B015NFTGTW
Battle Gear 2 [Japan Import],B00005OUS4
Toradora! Real Figure Prize Taito (only Aisaka Taiga) [Toy],B005JWSBZA
Taito Hatsune Miku Senbonzakura Miku Plush Toy Hatsune Miku (Crowe of P and Together) Separately,B01CM67H2I
Re:Zero Rem~Kimono Maid ver~,B08G4BKJ75
Doraemon secret tool mini figure Basho fan,B00RHZ5UDI
Taito Ano Natsu de Matteru Ichika Takatsuki PVC Figure,B00CW7XQ00
Taito Original Casual Clothes 4.7 Hatsune Miku Action Figure (Sega Version),B07YZRDLPC
Space Invaders 25th Anniversary Bundle [Japan Import],B0000AKGOJ
Taito ChaX GP Extra Large Smile Gloomy Pillow Stuffed Soft Plush 46cm Standard,B07PWL6M6W
Taito Re: Zero -Starting Life in Another World-: Rem Precious Figure (Original Cheerleader Version),B07VVB4KLQ
Yurikuma Arashi bear Ginsu Teddy stuffed toy,B016F4TYCY
Taito H:55 Super Sonico & Pochaco Original Multi Cloth,B00K8PLXUS
Taito Kaguya Luna PUCHIEETE Figure,B08CCDVKV9
. Single item Taito lottery Honpo Starry Sky register Ska F Award photo album design Bver (japan import),B00BFPI07E
Asphalt Urban GT (Taito Selection 2800) [Japan Import],B000EOVRW2
Taito Dragon Quest AM Glitter Room Light 20cm 2set DQ kawaii cute,B082HG2WG1
Don Doko Don [Japan Import],B0000ZPUL4
Kinnikuman M.U.S.C.L.E. Buffaloman figure Taito Kuji B Prize,B00CLKWRZI
Taito Final Fantasy XIV SL size stuffed Soft plush 30cm Mamet Nu Mou kawaii,B083LHY33S
Taito Ensemble Stars Relaxation 4 Class Set Stuffed Soft Plush Doll Genuine,B07DQD31L8
Rascal Does Not Dream of Bunny Girl Senpai Series: Coreful Figure Mai Sakurajima ~Bunny ver.~| Multiple Colors (T83221),B08GM2P41Z
Moomin oversized soft Motchi Ri ~ stuffed toy,B06Y17VZKH
Taito Queen's Blade Rebellion 7 Sigui Figure,B00AJIQXOU
Bubble Bobble,B00004R9H9
Taito Chakkusu GP XL guru-to-Real-of-The-Dead Stuffed Pink of The Dead Separately,B015SS4LIA
Taito 8 Free! -Eternal Summer-: Haruka Nanase Figure,B00U3DK0CW
Taito Final Fantasy XIV Khloe Aliapoh Figure Minion ver. 2017 FF14,B075S8V3J7
AMNESIA CROWD Amnesia cloud heart charm key ring Ikki separately prize,B071DXBDNC
Taito Hatsune Miku Winter Blanket 100ãŽ AYAMI ver. Pink RIN REN kawaii Vocaloid,B081TJYYFC
Taito Sword Art Online Alicization: Alice Synthesis Thirty Figure,B07RPM2CXK
Taito A.I.Channel Kizuna Ai Original Figure,B07YMC5ZRX
Dragon Quest Pocket Watch Slime & Metal Slime slime (single),B01N5OMN80
Taito Sword Art Online S.A.O. Senkou no Asuna Figure ~ 7 Asuna Yuuki,B00CMX34P6
Taito Hoozuki no Reitetsu Karashi Mustard Rabbit 13 Plush,B01M0S1P82
Free! Rubber badge Haruka Nanase prize,B06VV3SHJW
Taito Final Fantasy XIV Inflatable Vinyl Carbuncle (Emerald)| 17.7,B07GNWDYXM
Taito 5.9 Kantai Collection: Kancolle: Ro-500 Figure,B01BGXZJRS
松本零士 スーパーメカニクス クイーン・エメラルダス号(劇場版 銀河鉄道999ver.),B001KZ8KOW
Taito Final Fantasy XIV A Realm Tonberry Figure Room Lamp Light| 5.5,B01BHU4ZFW
Cadash - Sega Genesis,B000035XIG
Taito Guilty Crown Inori Uzuriha School Uniform Figure,B00BJREVJ4
taito Hatsune Miku original Summer ver. Renewal LD â€‹â€‹color Figure Figurine 20cm,B07V5SZ3XQ
Fleet collection - ship this -. Ver fracture length 10cm gun-chan slippers length 10cm gun-chan in the single item,B01LZBHG63
Baka to Test to Tsu in! G Award memo pad Mizuki & Hideyoshi & Minami maid,B01EBQ04PE
Pocket mini Tomica TOMICA 12 scale London bus LONDON BUS,B015D1YNRG
Super Sonico magical figure Sonico Pochako magic show of SUPER SONICO prize Taito Poster bonus,B00M6HPGSQ
Taito 7 Hatsune Miku Birthday 2019 Action Figure,B07T6SMQ7Z
Operation Wolf,B0039D38A4
Metal Gear Solid The Phantom Pain Desert Snake Tap Sound Cardboard Box,B01IRW271C
Yotsubato! DANBOARD cardboard figure stamp 2 Emotions SECRET separately,B00WVTU7DI
タイトー限定 ハイスクール・フリート 岬明乃 フィギュア タイトー制服,B01M2CTDY0
Kiteretsu Daihyakka big action figure roller assistant,B00XBWELVI
Taito lottery Free! Eternal Summer clear file & sticker whole set of 5,B00VJ89PXA
Ultimate Spider-Man [Japan Import],B000FAH8IW
Taito Gloomy GP Chax Bear Stuffed Plush| Pink| 10,B017EUXDT8
Champion Wrestler: Jikkyou Live [Japan Import],B000069U6D
Rambo III,B003AHZ0SW
Taito Persona 4 Arena P4U The Ultimate Kanji Tatsumi 8 Action Figure,B00EJ93VL8
Taito Guilty Crown: Kuji Honpo B Award Mana Ouma Figure,B0089LAD0O
FINAL FANTASY ALL STARS face cushion vol.2 Moogle,B06WD39X8T
Psychic Force Complete (w/ 3 Figurines) [Japan Import],B000BV44VE
Taito Monogatari Series: Black Hanekawa Figure,B01KPHP21O
Knight Quest,B000JX2D12
Final Fantasy XIV oversized fat Chocobo Plush Toy,B0194IUM2Y
Taito lottery Honpo Fate / stay night H Award Clear File Set Saber & Rin Rin other two separately,B00AJEA8XG
Color collection DX live! Ayase ERI separately,B00PJRN9OI
Taito Re: Zero -Starting Life in Another World-: Rem Precious Figure (Knit Dress Version) (Sega Version),B07YQJXDK9
Taito Monogatari Series: Shinobu Oshino Donut Figure,B0765QJNN8
Taito Hatsune Miku Autumn & Winter image stuffed Soft plush 16cm Autumn ver.,B07ZR5MZK9
taito Kankore Yahagi in preparation Renewal Figure Figurine 18cm japanese ver.,B08HK6Q9WB
Ensemble Stars! Deformed figure vol.4 2 species,B06XRCXHKQ
Ensemble Stars! T-shirt Trickstar white woman one-size-fits-all,B01MEG5425
Taito-Vocaloid Hatsune Miku Plush Toy Stuffed Doll- 7 Miku- Yellow Dress by Taito,B01F46X74K
Densha de Go! Final (Eternal Hits) [Japan Import],B000P4H6A8
Taito 6.7 Sword Art Online: Asuna Action Figure (Loading Version),B01GKRAUDI
TV animation Free! Deformed character figures Nagisa Hazuki popsicles,B018OZWTJM
Taito Re:Zero Rem～Sakura Ver~,B08ND3VVD9
Taito Rent a Girlfriend Big Plush ~Mizuhara Chizuru~,B08MBC36NZ
Fleet collection - ship this - dot picture rubber path case [Yamato] separately,B06VWXQFMK
Galaxy Express 999 Real Figure full set of 2 (japan import),B001KWX9DM
Taito Dragon Quest AM Big Figure Figurine 20cm Slime knight cute japanese LD,B07W4TY8SX
Taito 7 Love| Chunibyo & Other Delusions: Rikka Takanashi Figure Summer Clothes Ver.,B00L9OYWJQ
Taito Sakura Miku Big Plush,B08K3FC2ZD
Taito 8 Super Sonico Space Police Ver.,B00FAOW8XS
Taito Final Fantasy XIV Shining Mouse & Mouse Pad Volume 2 Fat Chocobo,B07M65S4T8
Queen of blades Anne Lotte Figure by Taito,B00OC137AS
Taito Square Enix Dragon Quest Green King Cure Slime Squishy Stress Ball Toy 7cm,B08GTL143Y
Taito lottery Free! Eternal Summer Clear file clear sticker Award Halloween separately,B00VKKWXWC
Taito Dragon Quest AM Slime 70cm Floor Mat,B07K42D3NG
Final Fantasy XIV minion figures vol.3 [thunk red| Krull] two Assortment,B06XV8Y3ZK
Galacta Meisaku Gekijou: Rakugaki Oukouku (PlayStation2 the Best) [Japan Import],B00007G79L
Taito Splatoon 2: Curling Bomb Cleaner (Sun Yellow Version),B07M8282JB
Ano Natsu de Matteru Waiting in The Summer Remon Yamano Figure,B07TMBFK9L
Taito iPhone 3G3GS corresponding cover Gurumi Gloomy all three four sets,B071NGHLX6
Taito Fate/Extra: Last Encore: Caster Nursery Rhyme Figure,B07GZPVMV4
We still do not know the name of the flower we saw that day. Meiko Honma Meiko Honma & Anjo Naruko figure [prize],B005UWKB5M
Taito Japanese Maguro Sushi Pillow,B01BVYNPBO
Taito Re: Zero -Starting Life in Another World-: Rem Precious Figure (Original Campaign Girl Version),B083RYD4YR
Taito lottery Free! Sweet macaron draw down multi-cross Last Happy Award,B00LBS3UFW
Taito 8 Super Sonico Winter Ver. Figure,B00PXB23CE
Space Invaders Mini Vinyl Figure,B01B3VVPV2
Taito Persona 4 The Ultimate in Mayonaka Arena P4U ~ 4 Elizabeth Figure -,B00GT4BPW8
Taito Sword Art Online: Alicization War of Underworld Big Plush ~Asuna~,B08MNVYKWT
Taito Super Mario Chain Chomp Bow-Wow Bowwow (It Moves When It Hears a Noise),B07NBHQNGC
Taito lottery Honpo Robotics and Notes F Award report set shallows autumn ear (japan import),B00AUCNN8E
Taito Lottery Free! Sugar Cake Nail Set Voice Code Award Nagisa Hazuki Separately,B00Q9LSQJG
Girls & Panzer theater version Oarai collaboration figure west to live ho,B0713W7NY3
White cat project star raccoon & carpenter raccoon stuffed star raccoon single item,B01EOMBLHK
Taito Kaguya-Sama: Love is War Big Plush ~Fujiwara Chika~| Multiple Colors (T83317),B08K3GC1MF
Taito Ensemble Stars Mugyu' and mascot Hasumi Yoshito,B07D3XWQVX
Taito Project Diva Hatsune Miku Sakura 2020 Version Figure| 7,B084DJD3G1
Taito 6.7 Sword Art Online II: Sinon Action Figure,B01DKU3N4G
Cardboard shampoo bottle DANBOARD SHAMPOO BOTTLE Yotsubato Anime prize Taito (with all two Furukonpu set + Poster bonus),B06XRD2T8N
Taito Final Fantasy XIV Oversize Senor Cactuar Stuffed,B01EWBKNM2
Taito Miffy Oversized More vol.4 Helmet Stuffed Soft Plush 46 cm Japanese ver.,B086J67F36
taito Hatsune Miku original Summer ver. Renewal Figure Figurine 20cm 2set cute,B07TRZ12CY
Taito Nyanbo swaying tail solar figure all four,B01MSZSY1O
Taito Kantai Collection Fleet Smartphone Speaker Vol.2,B07CQF6JR4
Hatsune Miku 10th Anniversary Kagamine Len Lottery Taito-Kuji Drawing Acrylic Charm Award,B07C3XQ1MB
Taito Persona 4 the Animation PVC Figure ~ 5 Nanako Dojima,B00ABWF30O
Puzzle Bobble 3 [Japan Import],B000069U6R
Taito Sakura Miku Stuffed Toy Stuffed Soft Plush Mascot 3set Miku Hatsune Japan,B07MVS1KP4
Taito Final Fantasy XIV: A Realm Reborn: Yukinko Stuffed Plush,B07V2FVRCT
Taito Final Fantasy XIV Minion Figure vol.2 Garuda 2.3 Tall,B01MY3G8FC
Great writer Stray Dogs lottery D-1 Award Atsushi Nakajima acrylic key chain acrylic charm,B06ZY9FKZJ
Taito 7 Kantai Collection: Kancolle: Shigure Kai Ni Space Invaders Collaboration Figure,B0764B5YCJ
Taito Re: Zero -Starting Life in Another World-: Rem Precious Figure (Original Sakura Version),B084DJK6TB
Taito Re:Zero Precious Figure Rem~ T Shirts on Swimwear~ Renewal| Multiple Colors (T83330),B08K3F9GNT
Taito 3.5 Kantai Collection: Kancolle: Ushio Figure,B019RTEWSK
The Castle of Shikigami II / Shikigami No Shiro II (Taito Best) [Japan Import],B0007XQ43W
電波女と青春男 藤和エリオ 単品 フィギュア タイトープライズ,B0060ROPVM
Persona 4 P4U di Ultimate in Mayo Naka Arena Kuji Lise & bear figure Taito (with all two full set + Poster bonus),B01KPI2UZE
Layer Section II [Japan Import],B000069S1S
Taito Dragon Quest AM Electronic memo pad Book of Adventure 18cm Japanese LD,B07S67RB59
Taito 459961500 Super Mario Bros. Ghost Boo Teresa Sensor Light,B01N4TT038
Bubble Bobble DS [Japan Import],B000BFGAVC
Taito lottery Honpo ensemble Stars! INSIDE all 28 species last Happy Award promotional materials set lottery tickets 60 sheets,B01M5HVKNN
Taito Great Writer Stray Dogs Sit Stuffed Ryunosuke Akutagawa,B01N1PZC6X
Taito Fate/Extra: Last Encore: Rider Francis Drake Figure,B07N9M8GQ6
Taito 451002700 Square Enix Final Fantasy FF All Stars Moogle Handlight Lamp Light Figure,B07FWKVVHZ
Taito 451113600 Project Diva Hatsune Miku Sakura Version Figure| 7,B07MJ4XM1M
Taito Super Mario Ultra Big Action Figure Bowser Game Japan Limited Goods,B07HNZWQPW
Taito Hoozuki no Reitetsu Karashi 12 Plush,B073RX4T8J
Taito Shirohime Quest: Aizu Wakamatsu Figure,B0151D90NI
Taito Pingu Extra Large Size Poses a Stuffed Toy Stuffed Soft Plush 38cm Japan,B07NWC363Y
Hatsune Miku 10th Anniversary Kaito Lottery Taito-Kuji Drawing Acrylic Charm Award,B07C3SF5X5
Taito 7 GRG x Super Sonico Race Queen Figure Gloomy Racing Genus,B00JG59ZHY
Taito Monogatari Series: Shinobu Oshino Donut Cushion Figure,B07FYL5RG8
Taito 6.3 Kantai Collection: Kancolle: Katori Figure,B01MSUGZD7
Taito Final Fantasy XIV Big Mandragora Queen 17 Plush,B01K8PPC7M
Taito Fate/Extra: Last Encore: Alice Figure,B07KVJGR1H
Final Fantasy XIV Extra Large Mandragora 15 inch Plush Toy,B01I2Z7SOK
Taito GP CGP-078 Gloomy Bear Mittens One Size Fits Most No Blood,B00Z8JP01C
Puzzle Bobble 3 for SegaNet [Japan Import],B000092PFI
Densha de Go! EX [Japan Import],B000069S55
A.L.C.O.N.,B003M27EHA
Taito Re: Zero -Starting Life in Another World-: Rem Precious Figure (Original Maid Swimsuit Version),B07SQQ7MHK
Yotsubato! Cardboard sensor with figures DANBOARD Taito,B06XRFKSDT
Free! Makoto Tachibana Pillow Case About 25 inch Width by Taito,B018FWK1R6
Taito Super Mario Bros. 1-UP Mushroom 12 Inch Plush Cushion,B01L9XDDMI
Taito Dragon Quest AM Dot Monsters Blanket 100cm Black DQ japanese limited cute,B07ZVWPXD7
taito patter of FFXIV USB Namazuo fan viable bacteria Assorted ver. Figure,B08C5LJ9GL
Taito Sumo Oversized Sumomi 42cm Stuffed Soft Plush Doll Genuine,B07NRZCJZZ
New Rainbow Islands [Japan Import],B000BVROSY
Taito lottery Free! Eternal Summer Flower afternoon flake seal Award Blossom single item,B014KDYQ3Y
Taito 451071500 Fate/Apocrypha Black Rider 7 Vol. 2 Figure,B07HMZNNY9
Final Fantasy XIV Minion Figure vol.1 - TATARU by Taito,B01N46SGN1
Suisui Sweet - Amai Ai No Mitsukekata [Japan Import],B0000E5SEF
After Class Love Beat [Japan Import],B000249UXM
スーパーマリオメーカー ビッグアクションフィギュア ビルダーマリオ,B01AHSJU7S
Taito My Youth Romantic Comedy is Wrong as I Expected Big Plush ~ Yukinoshita Yukino~ Big Plush| Multiple Colors (T83332),B08K3GY887
Jet de Go! 2 [Japan Import],B00005Y1PA
Little Busters! Itasha RC,B00GX322U4
Taito lottery Honpo Steins gate Chapter3 H Award report Paper & Notepad set â‘¡ separately Steins; Gate,B00P76YTUY
Date A Live 2 Tokizaki enthusiasts three figures,B00IRTRVGW
Taito Re:Zero Rem –Doll Crystal Dog Ears ver.| Multicolor| T83269,B08GM34CXQ
To Aru Majutsu no Index II Misaka Mikoto - Prize Figure (Taito),B004XSTKSS
Taito lottery Honpo Key ~ Second Edition ~ E award desk sheet rewrite single item (japan import),B009LFR4HW
Taito Shinobu Oshino [Sofa]: 12cm Jamma Prize Nishio Ishin Anime Project Statue Figurine Bundled with 1 A.C.G. Trading Card (TAI90804),B089SB4NQC
Taito Fate Stay Night Rin Tohsaka Prize Taito Premium Action 7 Figure,B002Z443EI
Zero Shikikan Josentoki Ni (Taito Best) [Japan Import],B000KKBJ2I
Taito lottery Honpo Ghost in the Shell: A Prize Motoko Kusanagi figure all one single item,B00G8K1SZ2
Taito Re: Zero -Starting Life in Another World-: Rem Precious Figure (Knit Dress Version),B0851V13Q2
Taito Doraemon Super Big 2019 Stuffed Soft Plush Doll Genuine,B07VH5YLTY
Free! Eternal Summer Rin Matsuoka figure childhood ver Anime prize Taito,B01B97XNOM
Taito Final Fantasy XIV All Stars Thea Rhythm Dissidia Cloud Strife Stuffed Plush| 8,B01M3U8J8Z
Taito Dragon Quest AM Loose Solar Figure Silver Metal Brothers,B07DVW6XS3
Taito Final Fantasy XIV A Realm Odder Otter Figure Room Lamp Light| 9.3,B07WPVST1Y
Taito 7 Hatsune Miku Figure Winter Image Version,B0819RSMH7
Densha de Go! Ryojouhen [Japan Import],B000067OZS
Taito Bungo Stray Dogs Atsushi Nakajima 6.3 Sitting Plush,B06XHXP2MP
Free! -Eternal Summer- SL Yamazaki Sosuke soft stuffed toy,B01HX8M3GK
Taito Ensemble Stars! Okami Akirakiba Metal Charm,B01K94QG2C
Taito Monogatari Series: Sodachi Oikura Figure,B01LYQAO18
Ys III Wanderers from Ys [Japan Import],B0002M2UC2
Taito Moomin Die Cut Tote Bag vol.2 40cm Moomin Kawaii Cute Anime Picture Book,B07VMNBW8P
Taito Puella Magi Madoka Magica Side Story: Magia Record - Kyubey 40cm Plush,B07N8MSTXV
Puzzle Bobble 3 DX [Japan Import],B000069U6X
Taito Space Invaders Pixel Beanie Peruvian Hat,B00FEO3GI0
Taito Guilty Crown Mini Chibi Figures-2.5 Gai Tsutsugami,B00AF0V8QK
