NAMBU IRON DEEP PAN (with lid and handle) designed by Sori Yanagi,B00UPPLW6G
Sori Yanagi Himefoku (japon importation),B00078MGFW
Sori Yanagi 22cm saucepan brushed stainless steel and aluminum layer 3 (Japan Import),B00078MHNI
STAINLESS STEEL MILK PAN (MATTE) by Sori Yanagi,B01MSMZCB5
Sori Yanagi stainless ball 19.23 2pcs (japan import),B00078MGZW
SORI YANAGI Iron Frying Pan [Fiber Line Processing] 18cm| No Lid (121511080009),B006T95NB2
Sori Yanagi Saucepan 18cm lid with Miller IH Disabled,B00FB2VICG
SORI YANAGI Large Teaspoon 162mm (000241) by Sori Yanagi,B01N0ARSBK
Sori Yanagi stainless ball 23.27 2pcs (japan import),B00078MH2Y
STAINLESS STEEL KITCHEN KNIFE 8. ½? by Sori Yanagi,B01N53BK6E
Sori Yanagi Teaspoon (Japan Import),B00078MG34
SORI YANAGI Punching Strainer 23cm (312120),B0000DIJ71
Sori Yanagi Four cradle,B003Q4CJ9M
Sori Yanagi Salad fork (Japan Import),B00078MGMK
Sori Yanagi Stainless Steel Tongs,B0002CET58
Sori Yanagi Beat (Japan Import),B0002CET6M
Sori Yanagi Perforated strainer - 16cm ? 19cm ? 23cm ? 27cm 4pcs 316076] (Japan Import),B008YPL4US
Sori Yanagi Matte Saucepan (22cm)312080,B0000DIJ6Z
Sori Yanagi Iron Skillet 25cm with Lid Frying-pan,B0000DIJ6X
Sori Yanagi Coffee spoon (Japan Import) by Sori Yanagi,B00078MG6G
Sori Yanagi Pasta 000258 (Japan Import),B004DSOVU0
Sori Yanagi YT-13 Nambu ironware Minipan (Japan Import),B0085GSR10
Sori Yanagi Stainless steel ball and strainer 27 2pcs (Japan Import),B00078MHLU
Sori Yanagi Dinner knife design 220mm (Japan Import),B004DSOW1I
Sori Yanagi Batter Beater,B0002CET7Q
Sori Yanagi shallow hands pot 22cm,B0002CET9E
Sori Yanagi Design Ice cream spoon 150mm (Japan Import) by N/A,B004DSS93A
Sori Yanagi (Perforated ladle) Sukinma S (Japan Import),B0002CET76
Sori Yanagi milk pan lid with matte,B0002CETB2
Sori Yanagi S [Turner| kitchen tools Sukinma ladle 3pcs 312009] (Japan Import) by Sori Yanagi,B01N32MDCY
Sori Yanagi / Fourchette de table inox,B004DSSBFG
Sori Yanagi iron frying pan 18cm with lid,B0002CET9Y
Sori Yanagi 311 070 stainless steel ball (3) set point (Japan Import),B0000DIJ6S
Sori Yanagi Muddler 000227 (Japan Import),B006K09WE4
Sori Yanagi Raised Glass 6oz (200ml),B00LL0ACN8
SORI YANAGI E Sori Yanagi stainless saucepan 18cm ( matte ),B007JT3MTQ
Sans couvercle 22cm plat peu profond saule Munemichi sud de fer ferronnerie (Japon import / Le paquet et le manuel sont ?crites en japonais),B000X8HU5W
STAINLESS STEEL KITCHEN BREAD KNIFE 12. ½? by Sori Yanagi,B01N95JA9S
Sori Yanagi Stainless Milk Bread Futatsuyakeshi,B00LL0AONG
NAMBU TEKKI CAST IRON POT SHALLOW 8.66 WITH LID AND HANDLE,B0011Z7V9Q
Sori Yanagi Cast Iron Grill Pan w/Lid and Fork Handle 22cm,B0011Z5VES
Sori Yanagi 22cm saucepan brushed stainless steel and aluminum layer 3 (Japan Import) by Sori Yanagi,B01AHGU9YI
Sori Yanagi Nanbu Tekki Iron Pan Deep 22cm Tetsufuta(Iron Lid) with Handle,B01MRHI82L
Sori Yanagi stainless aluminum three-layer steel saucepan 18cm ( with lid) 313 013,B00L18CW42
Sori Yanagi 121511080014 iron skillet with lid - 25cm fiber processing line] (Japan Import),B006T95NUS
STAINLESS STEEL KETTLE 2.5 Liter (MATTE) by Sori Yanagi,B01NB83YB6
Sori Yanagi Ladle Sugar 000142 (Japan Import),B004DSS9R6
Sori Yanagi Pasta pan (22cm) 312140 (Japan Import),B0000DIJ73
Sori Yanagi Japanese-Made Milk pan 16cm (Without Stainless Matte - lid),B0000DIJ77
Sori Yanagi Table fork 000029 (Japan Import),B004DSQ8G0
Sori Yanagi Teaspoon (Japan Import) by Sori Yanagi,B01AHGMY28
Sori Yanagi Tea spoon # 1250 (Japan Import),B004DSS7QO
Sori Yanagi Saucepan 22cm lid with Miller IH Disabled,B00FB2VJ7A
STAINLESS STEEL KITCHEN KNIFE 11 ½? by Sori Yanagi,B01N95J92T
STAINLESS STEEL PASTA PAN (MATTE) by Sori Yanagi,B01MSMZBVB
SORI YANAGI Milk Pan Lid 16cm| Mirror (312283),B000X8H69W
Sori Yanagi Ice Cream Spoon Set 6pcs,B01MSJ47PP
Sori Yanagi Server fork 311934 (Japan Import),B004DSUGUO
STAINLESS STEEL SHALLOW PAN (MATTE) by Sori Yanagi,B01MXM6ZIY
Sori Yanagi Perforated strainer chauffeured 23cm 312313 (Japan Import),B000X814L8
Sori Yanagi ballon inox 13cm 311001 (japon importation),B0000DIJ6N
Sori Yanagi Stainless Steel - Skimmer [Perforated ladle],B0002CET8K
Sori Yanagi Japanese-Made Three-Layer Steel Saucepan 22‡p (Stainless Steel + Aluminum 3 -Layer - Matte) IH Correspondence,B004D2M6VW
Sori Yanagi Dessert spoon (Japan Import),B00078MG02
Sori Yanagi Stainless steel ball 23cm 311031 (Japan Import),B0000DIJ6Q
Sori Yanagi Butter knife 000111 (Japan Import),B004DSQB58
Sori Yanagi Southern Iron iron pan deep 22cm Tetsufuta with handle,B009QDLD9Y
Sori Yanagi Stainless Cutlery ò1250 Dinner Spoon,B00LL0B5R0
STAINLESS STEEL COLANDER (MATTE) by Sori Yanagi,B01NA708EM
Damascus Chef's Knife| Yanagi Sori 18cm| Premium Carbon Steel Gyuto| Corrosion resistant,B00XH597MM
Sori Yanagi Cake fork set point # 6 1250 CF-6PC (Japan Import) by Sori Yanagi,B01AHFNUM2
Sori Yanagi Kitchen knife 18cm (Japan Import),B0002CETEO
Sori Yanagi 121511080014 iron skillet with lid - 25cm fiber processing line] (Japan Import) by Sori Yanagi,B01C85D830
Sori Yanagi Stainless Steel Tongs - Perforated,B0002CET5I
Sori Yanagi Design coffee spoon 118mm (Japan Import),B004DSS7U0
Kettle Yanagi Sori -matte finish -Made in Japan,B0000DIJ6U
Sori Yanagi 312290 matte lid 16cm milk pan (Japan Import),B008YPL4WQ
Yanagi Stainless Cutlery - 4 Piece Place Setting,B00MG4PBA2
Sori Yanagi Perforated strainer chauffeured 23cm 312313 (Japan Import) by Sori Yanagi,B01AHFUQKQ
Sori Yanagi stainless ball 19.23.27 3pcs (japan import),B00078MGWK
Sori Yanagi Brushed his hands deep pot (22cm) 312150 (Japan Import),B0000DIJ74
Sori Yanagi Miller 311 140 18cm Stainless Steel Saucepan,B01N8P3T65
Sori Yanagi 13.16.19 3pcs stainless steel ball (Japan Import),B00078MGT8
Sori Yanagi Stainless steel| aluminum three-layer steel deep hands pot 22cm matte,B00078MHO2
Sori Yanagi Saucepan 18cm lid with Matte - IH Disabled,B00FB2VHT0
Sori Yanagi Strainer - 16cm ? 19cm ? 23cm Punching 3pcs 311330] (Japan Import),B008YPL2P0
Stainless saucepan 18cm with lid ( matte ),B00IQ39Z5O
NAMBU IRON GRILL PAN (with lid and handle) designed by Sori Yanagi,B00UPPLV62
SORI YANAGI Dessert Knife 210mm (000050),B004DSORUE
Sori Yanagi Soup spoon (Japan Import),B00078MFQ2
Sori Yanagi stainless bowl punchingstrainer (16.19.23) 6pcs,B00078MHLK
Sori Yanagi Serving spoon 311941 (Japan Import),B004DSSC8M
STAINLESS STEEL 3 PC. SMALL KITCHEN TOOL SET by Sori Yanagi,B01NA70R54
Sori Yanagi Ladle (M),B0002CET8A
Sori Yanagi Punching Strainer 23cm (312120),B01N02J8PY
Sori Yanagi Turner (turner) (Japan Import),B0002CET8U
Sori Yanagi Kitchen knife 14cm (Japan Import),B00078MHOC
Sori Yanagi (Yanagisouri) Sori strainer bowl &amp; punching set two points 311|011.312201 (Japan Import),B00128XGQY
Sori Yanagi IH Saucepan 18cm Matte,B00D73AYSK
Sori Yanagi stainless saucepan 18cm matte [MTD158],B00469PYVQ
Sori Yanagi Stainless Steel Ball and Strainer 27 2pcs (Japan Import),B01N3XQUK4
Sori Yanagi Japanese-made three-layer steel saucepan 18p (stainless steel + aluminum 3 -layer - matte) IH correspondence,B00078MHN8
Sori Yanagi Stainless Saucepan 18cm with lid (Matte),B00IQ3B01G
Sori Yanagi Stainless Steel Tongs by Sori Yanagi,B01MY6ZWA8
Sori Yanagi Perforated strainer chauffeured 23cm 312313 (Japan Import) by Sori Yanagi,B01MZ8ICAB
Sori Yanagi 13.16.19.23 4pcs stainless steel balls (Japan Import),B00078MH6A
Sori Yanagi Nambu ironware oil pan 22cm (with lid handle iron) (Japan Import),B00078MHMY
Sori Yanagi Milk pan with lid mirror (16cm) (Japan Import),B0002CETAS
Sori Yanagi Dessert fork 000067 (Japan Import),B004DSS7FU
Sori Yanagi 140mm fork design Hime (Japan Import),B004DSVK8Q
STAINLESS STEEL 6 PC. SMALL KITCHEN TOOL SET by Sori Yanagi,B01MYNPAST
Sori Yanagi Food Strainers Punching strainer 19cm,B0002CETAI
Sori Yanagi Stainless Steel Kettle - Mirror,B0000DIJ6T
Sori Yanagi Japanese-made saucepan 18cm (with stainless matte - lid),B0000DIJ6W
Sori Yanagi source ladle 001439,B008YPL2Q4
Sori Yanagi Stainless Steel - Fork ladle,B0002CET94
Sori Yanagi Stainless Saucepan 18cm (Matte) 311 151,B008V9DZ18
Sori Yanagi (Perforated ladle) Sukinma S (Japan Import) Model: (Home & Kitchen),B014USTOPE
Sori Yanagi Carbon Steel Pan Magma Plate 9.84 with Lid,B01MDP6J23
Sori Yanagi punching strainer (monkey) 19cm 312110,B0000DIJ70
Sori Yanagi Iron frying pan with lid 22cm (Japan Import),B0002CET6C
Sori Yanagi Stainless Saucepan 18cm Mirror 311 141,B004JKWV9K
Sori Yanagi Southern Iron 22cm oil pan (no lid) (Japan Import),B00078MHME
Sori Yanagi / Fendue Spatule,B0002CET7G
Sori Yanagi Perforated strainer chauffeured 16cm 312306 (Japan Import),B002RFFFUG
Sori Yanagi 25cm stainless steel plate (Japan Import),B00078MHCO
Sori Yanagi iron frying pan [fiber line processing] 18cm lid with 121 511 080 010,B006T95NAI
Sori Yanagi Kitchen Tools S [Turner Skimmer| ladle] 3pcs 312009,B001294KLI
Sori Yanagi bread knife 21cm,B0002CETEY
Sori Yanagi Pasta pan (22cm) 312140 (Japan Import),B01MRHIG3S
STAINLESS STEEL KITCHEN KNIFE 10. ½? by Sori Yanagi,B01N64Q4GN
Sori Yanagi iron frying pan [fiber line processing] 22cm lid with 121 511 080 012,B006T95NAS
Miller 311 140 18cm Stainless Steel Saucepan Sori Yanagi,B0000DIJ6V
Sori Yanagi ballon inox 27cm 311040 (japon importation),B0000DIJ6R
Sori Yanagi 18cm stainless steel plate (Japan Import),B00078MH9M
Sori Yanagi stainless saucepan 18cm mirror,B0070JJE74
Sori Yanagi Butter knife (Japan Import),B00078MG9S
Sori Yanagi Bone China Plate 19cm,B00LL0A382
STAINLESS STEEL DEEP PAN (MATTE) by Sori Yanagi,B01N2HR2FI
Sori Yanagi Tablespoon 000036 (Japan Import),B004DSMVWA
Sori Yanagi Ladle S (ladle) (Japan Import),B0002CET6W
SORI YANAGI Large Teaspoon 162mm (000241),B006K09WUS
Sori Yanagi fourchette ? dessert (quatre pales) (Japon import / Le paquet et le manuel sont ?crites en japonais),B00078MGJ8
Sori Yanagi 19.23.27 3pcs strainer (Japan Import),B00078MHM4
Sori Yanagi Southern Iron Iron Mini-pan without lid YT-13,B006K0ADNI
