Taito Hatsune Miku Summer Image Mascot Stuffed Soft Plush 11cm Marine ver. Cute,B07V5M8GPW
Taito 6.6 Kantai Collection: Kancolle: Yamato Figure,B017VZZFO2
Insector X,B000FYI9PE
SK Japan Kirby's Dream Land: Kirby Portable Fan,B07VYHLTRN
Taito Re: Zero -Starting Life in Another World-: Rem Precious Figure (Knit Dress Taito Online Crane Version),B07YHCFM4J
Taito Ano Natsu de Matteru Mio Kitahara Vol. 2 PVC Figure,B00B0NLO9C
lovelive! ƒÊ's holding hands deformed Keychain [Minoru Kosaka ”T‰Ê],B0182B97TS
XII Stag [Japan Import],B00008CP2P
Taito Re:. Zero Rem original campaign girl ver Precious PVC Figure 22cm,B084KS19N9
Taito Hatsune Miku Costumes Cafe Maid Version Figure| 7,B08K2RZGDS
Two medium-writer Stray Dogs Nakahara Hakosuta acrylic key chain,B071S9MV94
I want to have love even in the two disease! Original reversible cushion all one,B00I7N6O70
Puzzle Bobble 2 [Japan Import],B000069U6E
Taito Guilty Crown Premium Quality PVC Figure ~6.5 - Tsugumi,B008TOYNTS
Renegade,B000B4133I
Taito 7 Hatsune Miku Birthday 2020 Action Figure,B089CKBFW7
Gokuraku! Chuuka Taisen [Japan Import],B0000ZPUOG
Taito 7 Sword Art Online Alicization: Asuna Yuuki Action Figure (Casual Clothes Version),B0851TQ6B4
Taito Sword Art Online II Phantom Bullet 5 Sinon Action Figure,B00UCWQ9UQ
Taito 7 Kantai Collection: Kancolle: Akebono Space Invaders Collaboration Figure,B078MHJP32
Taito 7 Kantai Collection: Kancolle: Kashima Figure,B01N5HNZP3
Osomatsu's holding hands deformed key chains separately fourteen pine,B01EMZCPPG
Taito Final Fantasy All Stars FF Blanket Lightning Japan Limited,B0771MCFNB
Free! Eternal Summer SL Rin Matsuoka soft stuffed toy,B01DFXHYH0
Taito Final Fantasy XIV Moogle Desk Clock Red| 6.3,B082BCPF1X
Final Fantasy Mysidian Rabbit Plush H about 16.5 inches FF XIV by Taito,B01KJESPKS
Taito Bakemonogatari Black Hanekawa/Hanegawa in Pajamas 5 Action Figure,B00EJ93U5U
Taito Dragon Quest AM Big Stuffed Soft Plush 25cm Mimic & Dancing Jewel Mimic,B07SGBXBQT
Taito Gloomy Bear Plush Doll Argyle GP #519 Stuffed Animal Japan Jumbo Size 12 Inches Pink,B07Q6VW92G
Pet Shop Monogatari DS [Japan Import],B001931WEA
Taito Final Fantasy XIV Crystal Motion sensors Light Japanese ver. Cute Kawaii,B088R17TYN
Ensemble Stars! Mugyu' and mascot Trickstar Koritaka Hokuto single item (prize),B01G1GCI5G
Full set of 2 figures vol.2 Tanigawa Kitahara beauty Sakura waiting in that summer (japan import),B00A0C8E8S
Taito Rascal Series Coreful Figure Sakurajima Mai ~Newly Written Knit Dress ver.~,B08MBCZ46P
Doraemon BIG stuffed animal,B00PVJXY58
Hatsune Miku 10th Anniversary Lottery Taito-Kuji Drawing Acrylic Charm Award,B07C3RHLJF
Metal Gear Solid V CAUTION sound sensor light by taito,B016D3CAGE
Ensemble Stars multi Cross A single item,B01D5MK64Y
Taito Monogatari Series: Hitagi Senjogahara Figure (Owarimonogatari Version),B079HM6KJP
Side by Side Special 2000 [Japan Import],B00005OUSE
Final Fantasy XIV Minion Figure vol.1 - Y'SHTOLA by Taito,B01LYLPSAQ
Taito 6.3 Kantai Collection: Kancolle: Hamakaze Figure,B01F0OZY9M
Final Fantasy XV FF15 Kuplu Kopo Moogle Big Plush Stuffed Doll 23,B06Y637FNT
Final Fantasy XIV Minion Mascot Plush 3pcs Malboro Behemoth Mandragora,B01G9PA9NC
Taito 7 Monogatari Series: Yotsugi Ononoki Figure,B00SML2N5Y
Giga Wing Generations [Japan Import],B0007MSMG0
Starry Sky earphone jack Metal Charm Homare Kanakubo,B06WGP46S9
Taito 5.1 Kantai Collection: Kancolle: Yukikaze Figure,B01I20TNAC
Taito 7 Steins;Gate Hiyoku Renri no Darling: Kurisu Makise Figure,B009ZOU0NE
Slime AM slime pump bottle (blue) Dragon Quest,B01IVLV1FM
Taito Dragon Quest AM Big figure Killing Machine,B075D9TH9L
Hatsune Miku Senbonzakura earphone jack Metal Charm Miku ( black ) / Miku ( red) / Miku ( blue ) Set of 3,B00E6P0ARS
Taito Final Fantasy XIV A Realm Moogle Speaker| 5.9,B077T93MK3
Taito Hatsune Miku Autumn & Winter image stuffed Soft plush 16cm 2set kawaii,B07WGBWDF9
Taito Space Pirate Captain Harlock Super Mechanics Arcadia (TV Anime Color) (Japan Import) Corporation,B001MZ7OC4
Taito 6 Kantai Collection: Kancolle: Shimakaze Figure Decisive Battle Mode,B0825TK7TZ
Taito Re:Zero Big Plush ~ Rem~| Multiple Colors (T83331),B08K3FRJ6V
Taito Steins; GATE Steins; Gate Porch Snubbull UPa Stuffed Soft Plush Doll Genuine,B077RWQVKK
Taito Granblue Fantasy Vee Stuffed Plush Doll| 12,B01M31JCJR
Taito 6 Sword Art Online II: Yuuki Figure,B0171B090Q
Taito 7 Kantai Collection: Kancolle: Amatsukaze Figure,B0725RG3FZ
Taito Hatsune Miku [Autum Outfit RE:ver]: 18cm Vocaloids Original Statue Figurine Bundled with 1 A.C.G. Trading Card (TAI71100),B089G7PMK9
Taito Snow Miku Image Headphones Limited ver. Black & Blue Japan Limited,B07NGM2GDB
Taito Super Sonico Summer Beach Swimsuit Figure - Lemon Macaron,B00KO3EF6I
Taito Kantai Collection: Shimakaze Love Kanmusume Figure,B0778H4HKX
Space Battleship Yamato Resurrection Hen Super Mechanics Yamato (japan import) by Taito Corporation,B002YTMFWG
Tensai Bit-Kun: Gramon Battle [Japan Import],B0000AKGOB
Taito 6 Free! -Eternal Summer-: Haruka Nanase Figure Youth Ver,B004L3YVMA
STAND BY ME Dora Doraemon big action figure (arcade prize),B00MK25M2W
Taito Chakkusu GP All Purpose Rabbit Stuffed Plush [Trimming Coat Look] Standard,B07TM44GKT
Taito Chakkusu GP Oversized guru-to-Real ~ TEXTILLIC Round one Limited Damask Purple Stuffed Soft Plush Doll Genuine,B07C6HGWFY
Taito Kirby of The Stars PUPUPU Friends Cain Kirby Big Stuffed Soft Plush 30cm,B07R447ZK8
Taito lottery PSYCHO PASS- psychopaths - E Award pouch design ‡@,B00QTAAN1Q
Taito Persona 4 the Animation PVC Figure ~ 7 Rise Kujikawa,B00ABWF27I
Taito Snow Miku Image Headphones Limited ver. White & Blue Japan Limited,B07N7BMC5B
Taito Final Fantasy XIV Minion Micro Gigantender Solar Figure 15cm,B08KQ23YXF
Hat Trick Hero S [Japan Import],B000069U6F
Taito Gloomy GP Chax Bear Stuffed Plush| Pink| 10 by Taito,B01N7CDQTI
Taito Fate/Apocrypha: Assassin of Black 7 Action Figure,B078NJ5Y93
taito Ichiro Hypnosis Mic Hypnosis microphone Division Rap Battle hooking figure Buster Bros !!! Basuburo Ichiro Yamada figure PVC Figure Figurine Genuine,B07T2MVVMJ
Great writer Stray Dogs Ranpo Edogawa stained glass specification acrylic Keychain,B071RJ943H
Seirei Densetsu Lickle (Little Samson)| Famicom Japanese NES Import,B000068I3R
Taito Final Fantasy XIV Moglie Moogle Room lamp Blue Japan Limited,B074LJXYML
Mawaru Penguindrum Takakura Himari & Oginome RIngo Set of 2,B007PQ5I04
Demon Sword,B00004SVOU
Shin Megami Tensei Jack Frost 25th Anniversary Wallet,B07CLQ93JW
Taito Guilty Crown Mini Chibi Figures-2.5 Inori Yuzuriha,B00AF0V9SC
Bubble Bobble Old & New,B0001NBNEI
Taito Moomin fluffy oversized stuffed animals,B00TRQ260A
Taito Fate/Apocrypha: Rider of Black 7 Action Figure,B077SLPXKG
Taito Splatoon 2: Curling Bomb Cleaner (Neon Pink Version),B07FT8PJZ3
Persona 4 Yukiko Amagi figures Taito prize,B008FVHHZW
Taito Final Fantasy XIV: A Realm Reborn: Happy Bunny Stuffed Plush,B07YP8MVBL
Hatsune Miku ~Mandarin Dress ver~ Prize Figure| Multiple Colors (T83268),B08GLZXJ3N
Taito Miffy Melanie Limited SL Size 2020 Autumn Stuffed Soft Plush 30cm Kawaii,B08HZBZ1HV
Mushi Hime Sama [Japan Import],B000G15WLA
Taito lottery Free!,B00Q9LSSYO
Taito Re: Zero Precious Figure Figurine 15-20cm REM Salopette Swimsuit SP ver.,B0833H86N7
Taito Re:Zero Rem~Winter Cloth ver~,B08JKFLYCG
Taito Hatsune Miku Summer Image Mascot Stuffed Soft Plush 11cm Normal ver. Cute,B07V3JXC6F
Bakemonogatari Real Figure Hitagi Senjougahara separately by Taito,B003JZ0VUW
Dragon Quest Blue Slime 14 Plush Toy [Taito],B075TT3Z5T
Space Raiders [Japan Import],B00007HMVQ
Nyanbo swaying tail solar figure all four,B01N7ISCWQ
Taito Made in Abyss Nanachi Kuttari Stuffed Soft Plush Anime,B07PJ42GX7
Taito Shimakaze Decisive Battle Ver. Kancolle Prize Figure,B08L8XGQ7L
化物語 八九寺真宵リュック,B00C981SG6
TasukuTenruiko separately Aru Kagaku no Railgun Misaka Mikoto TasukuTenruiko figure whole set of 2,B006G599CI
Yokushin: Gigawing Generations (Taito Best) [Japan Import],B000CMRWB6
Mushihimesama [Japan Import],B0009NUOQS
Osomatsu's holding hands deformed Keychain vol.2 separately Choro pine,B01N2L0X4L
Taito Lottery Honpo Leaf X AQUAPLUS B Prize Draw Down Cushion All one,B00HQ8K8J2
Pocket Tomica (TOMICA) P045 NISSAN FAIRLADYZ Fairlady Z TAITO,B01HM00SWU
Sega Love Live! Sunshine!! Nesoberi Plush Doll Third Grade Kanan Matsuura Aozora Jumping Heart Ver. 6.7,B07KS8BMYN
Taito Monogatari Series: Second Season Shinobu Oshino Figure,B015A46NZG
Battle Gear 3 [Limited Edition] [Japan Import],B0000E5SEV
Taito Lottery Honpo Fate / Stay Night E Award Treasure Fixture Type Ballpoint Pen Caliburn Single Item,B00AJE7DS4
Aru Kagaku no (Railgun) Misaka Mikoto & Kuroko Shirai night figure [all] two full complete,B006QRT5DO
Taito Kantai Collection: Amatsukaze Love Kanmusume Figure,B07B7PB64P
Taito Final Fantasy All Stars Cloud Face 16 Cushion,B01NCQQ9O6
Taito 7 Super Sonico Figure Blue Ver.,B00BIXK99K
Taito lottery Free! Sugar Cake deformed figures Award Rin Matsuoka single item,B00Q9LSQ1E
Lady Stalker: Challenge from the Past| Super Famicom (Super NES Japanese Import),B0000645OH
Taito 8 Super Pochaco Figure Along with Sonico,B00L2KUJQC
Taito Final Fantasy XIV Online Minion Wind Bell Chocobo FF,B07W798T92
Bungo Stray Dogs 12 Big Plush Doll - Osamu Dazai,B01IJNQ18O
Taito Re: Zero -Starting Life in Another World-: Rem Precious Figure (Room Wear Version),B08KQ164TR
Psychic Force Puzzle Taisen [Japan Import],B00006LJVW
Moyashimon Monera Soft Vinyl Figure 4th Torikoidesu C. Torikoidesu separately figure prize Kaiyodo TAITO,B00SQOWME4
Relax Chaya bath towel white separately,B071H6XXSX
Taito Splatoon 2: Splat Roller Cleaner,B075GJ99XR
Tensai Bit-Kun: Gramon Battle [Japan Import],B0000AKGOG
Taito Original Summer Clothes 7 Hatsune Miku Action Figure,B073TJW5CV
Taito Ensemble Stars! Deformed Figure Vol. 1 Chiaki Morisawa PVC Figure,B01MTDJVSY
Taito Re:Zero - Starting Life in Another World Rem - Campaign Model Costume ver.,B08GM2ZZ4H
Evening figure skating story monster Guattari Nishio Ishin Anime Project Cosplay Prize Taito eighty-nine temple true (japan import),B006DYC2CQ
Taito Ensemble Stars Mugyu' and Mascot Knights Sakuma Rintsuki Single Item,B01IH9GLIU
Estpolis Denki II (Lufia 2: Rise of the Sinistrals) Super Famicom (Super NES Japanese Import),B000068I47
NINJA SAVIORS RETURN OF THE WARRIORS (UK IMPORT) [T],B07W93R74Y
Ys V - Lost Kevin| Kingdom of Sand [Japan Import],B000CSJ16O
Taito Yosuke Hanamura in Mayonaka Arena Action Figure,B00D75NAYI
Taito Re:Zero Precious Figure Rem ~Knit Dress ver.～ Renewal～| Multiple Colors (T83326),B08K3FHYD8
Date A Live strap origami,B01N0WOR2F
Mikoto figure index Mikoto Misaka Taito in Love banned list II of Certain Magical (with bonus poster) (japan import),B00AUT12VM
Taito Persona 4 P4U The Ultimate in Mayonaka Arena Aigis 6 Figure,B00BMI1EZE
Hatsune Miku Plush Doll Series Miku & Akiko stuffed full set of 2,B01AI61LYE
Free! Draw down lying pillow cover Makoto Tachibana by TAITO,B00RV4BMNW
Taito Dragon Quest AM Headphones Slime & King Slime Game Japan Limited Goods,B07HNXYYTM
Cool-headed cat good good of the ground cherry & NekoYoshiYoshi her stuffed NekoYoshiYoshi (single),B013N5HTQG
Taito Final Fantasy All Stars Deformed 6 Plush Doll Vol.4 Vaan,B06VVQ2GCQ
Taito Hatsune Miku Uniform Ver. Prize Figure,B08L45WZ7T
Taito Yotsuba &! Danboard Speaker,B00EV0BPAO
Heaven's Will [Japan Import],B000HDU19K
Taito Hatsune Miku Winter Live Action Figure Smiling Version,B082L45YL8
Taito Ensemble Stars! Deformed Figure Vol. 1 Subaru Akehoshi PVC Figure,B01N5TTDZW
Puzzle Bobble 4 [Japan Import],B00006LJGX
Taito 7 Hatsune Miku Winter Live Figure Action Figure (Sega Version),B082VHR6BC
Taito Final Fantasy XV Cactuar Cushion Stuffed Soft Plush Japan Limited 45cm,B077ZVVKKC
key Taito lottery F Award desktop LCD cover Rewrite Feng Chihaya,B00D6B14XM
Taito Persona 4 Arena P4U The Ultimate Naoto Shirogane 7 Action Figure,B00EJ93VKY
Taito Hatsune Miku Winter stuffed wink separately,B07D72332W
Taito 6 Attack on Titan: Krista Lenz Figure,B0161XXWV8
Gunslinger Stratos Dogma-magma SL stuffed dogma separately,B00B0LJS6U
Puchi Copter 2 [Limited Edition] [Japan Import],B0009CM8DG
Densha de Go! Final [Japan Import],B0001TXT3K
Taito Re: Zero -Starting Life in Another World-: Rem Precious Figure (Original Cheerleader Special Version),B07ZS256D4
Taito lottery Honpo Free! Square porch Award deformed characters (blue) separately,B00GOSPRFK
Taito SINoALICE Clean Nightmare Stuffed Plush Blue Version Japan Limited Goods,B07NC2S7Z1
Super Mario Bros Green Yoshi Big Acition Figure 12 inch,B018QFWVOI
Kantai Collection KanColle Deformed Figure Vol. 8 Amatsukaze PVC Figure,B01N38E68C
Ensemble Stars! Deformed figure vol.3 [Okami Akirakiba] separately,B01NCDUQ21
Saikyo Shooting Collection Vol.1: Strikers 1945 I & II [Japan Import],B00028EW68
Taito Re: Zero -Starting Life in Another World-: Rem Precious Figure (Marine Look Version),B089SQN2Y9
Taito Date A Bullet Coreful Figure - Tokisaki Kurumi～Swimwear ver.～ Prize Figure,B08K3FJRTC
Taito Ultraman Head Type Motion sensors Light 15cm Japanese ver.Cute Kawaii,B08BJW7TTC
Taito Final Fantasy XIV Bomb of Yura Pika Keychain 3 Set Stuffed Soft Plush Japan Limited,B073S54JCZ
Taito Ano Natsu de Matteru Kanna Tanigawa PVC Figure by Taito,B01LW6XB67
Darius Gaiden [Japan Import],B000069U6G
Watashi no Happy Manner Book [Japan Import],B000NCAPDC
Super Mario Bros. Red Koopa Shell Plush Toy,B01CGZ3CHE
Taito UFO Crane Dragon Quest King Slime Extra Large 16 Stuffed Plush,B08DRV5DP1
Taito Dragon Quest AM item's Gallery Special Zenithian Sword Heavenly Sword 22.8inch,B07N82TBYZ
Taito Hatsune Miku 10th Anniversary Kuji Honpo Action Figure,B079KQ5XTB
Taito Dragon Quest AM Big Stuffed Slime and Slime Beth Separately [Slime],B01IGZ5UP0
Taito Sukueni Cafe Nier Automata Vacuum Stainless Steel Tumbler New 2B 9S All Two NieR: Automata,B071V4V76F
Banpresto Marvel Iron Man 6.3-inch Creator x Creator Series Figure,B07DMTFHJW
Taito Re: Zero -Starting Life in Another World-: Rem Precious Figure (Original Salopette Swimsuit Version),B082WB1DTK
Taito 7 Hatsune Miku 2nd Season Summer Version Action Figure (Taito Online Crane Version),B07V67GCD8
Elevator Action,B000GBMGLY
Hakuoki SSL Sweet rubber strap Chikage Kazama separately,B00SP0MKA0
Langrisser III [Japan Import],B000A41FM8
Taito Ensemble Stars Mugyu' and Mascot Knights ShuSakuraTsukasa Single Item,B01IH9RZ80
Taito 7 Kantai Collection: Kancolle: Akizuki Otsukimi Figure,B01LHIJQ3U
Taito 8 Super Sonico Taito Staff Costume Ver. Figure,B00L8EIO5K
Doraemon the Movie: 2016 Birth of Japan Shin Nobita big action figure [Doraemon],B01D2NG0MS
Super Mario oversized Kutatsu and stuffed Yoshi Midori Yoshi single item,B019DNJC58
Metal Gear Solid The Phantom Pain Rock/Sand Snake Tap Sound Cardboard Box,B01IRW29MY
Taito Super Sonico Summer Beach Swimsuit Figure - Muscat Macaron,B00KO3EG9O
Taito Final Fantasy XIV Tataru Figure (Minion Version),B08733PV6W
Taito lottery Honpo Robotics Notes G Award rubber key chain gods Frau separately,B00AUCQ0PM
Saekano: How to Raise a Boring Girlfriend Big Plush ~Kato Megumi~ Big Plush,B08K3DDQ76
Final Fantasy XIV design pocket watch silver (Moogle),B01J3I1AKS
Taito Kirby's Fluffy Fluffy Super Big Plush Peluche 40cm 15.7 inches,B084L1PLM3
Dragon Quest AM Items Gallery Special Erdrick Roto Shield Dragon Quest 36cm 14.1,B07F5F9QZQ
Taito 6 Free! -Eternal Summer-: Rin Matsuoka Figure Youth Ver,B017VXNRJ4
Taito 7 Hatsune Miku 3rd Season Summer Version Figure,B08DFXQG4H
Ensemble Stars! Deformed figure vol.4 Izumi Sena single item (prize),B01MU5CA1Z
Taito Final Fantasy XIV Fat Chocobo Alarm Clock (White)| 6.3,B07HWY1SJR
Ultimate Spider-Man [Japan Import],B000FAJCM2
Arkanoid DS (w/ Paddle Controller) [Japan Import],B000W6O6DY
Taito Kantai Collection Maya Holiday Ver. PVC Figure,B01N4CCCDM
Funassyi Sorabi of Dole Nasshi Funabashi rocal character,B01E4XOWVQ
Taito Super Robo Nix Brave Raideen,B06XTHL3VZ
Fleet Collection ( this ship ) Bath Towel [ Tenryu u0026 Tatsuta ] separately,B00JXD1DPQ
Great writer Stray Dogs Doppo Kunikida stained glass specification acrylic Keychain,B072B726RJ
Taito Baka to Test Tsu in! Swimsuit Figure Prize (with All Two Full Set + Poster Bonus),B01KPI30HG
Taito 7 Hatsune Miku Birthday 2019 Action Figure (Sega Version),B07X29B6C5
Taito Dragon Quest: Emblem of Erdrick Pocket Watch (Silver),B074D1D43H
Taito Re:Zero Starting Life in Another World: Rem Marine Ver Action Figure,B08GQL7M7K
Taito 7 Hatsune Miku Winter Live Figure Action Figure,B07XYZG4TD
Taito Final Fantasy Dissidia All Stars Carnival Vol 6 Bartz Klauser 7 Plush,B06Y4GHHXF
Taito lottery Honpo Leaf ~ AQUAPLUS E Award mini multi-cross all four set,B00HQ8QAJY
Rozen Maiden: Geppetto Garden [Japan Import],B000LQWONE
Taito Rent a Girlfriend Coreful Figure Chizuru Mizuhara| Multiple Colors (T83208),B08GM46JZY
Denpa Onna Big blanket vertical blue Elio pajamas,B00UH28RMY
Taito Dissidia Final Fantasy Opera Omnia Pocket Watch vol.1 [Warrior of Light] Japan Limited,B07DLY75FY
Taito 8 Super Pochaco Winter Ver. Figure,B00OUIGYTE
Taito Hatsune Miku Winter stuffed glasses separately,B07D6ZFV7Y
Taito Doll Crystal Sakura Miku Figure,B086HKGN2N
Taito Monogatari Series: Second Season Mayoi Hachikuji Figure,B014IEZ9MM
Taito Memories II Joukan (Eternal Hits) [Japan Import],B0017P1QUU
Taito 5.9 Attack on Titan: Hange Zoe Figure,B01D1LD7QS
Banpresto KanColle goblins Akashi holiday figure SQ SPM 2 species set (japan import),B071L275SB
Taito Dragon Quest AM Slime Smartphone Speaker,B01L8H1FA2
Taito Final Fantasy All Stars Deformed 6 Plush Doll Vol.3 Warrior of Light,B01MTAJ5E9
Bust-a-Move 4,B00004RBF6
Capsule Sengoku Roman Tan your amulets all eight set,B003MLNYU2
Taito 6 Kantai Collection: Kancolle: Shimakaze Figure,B00LHPK7KU
Ray Tracers [Japan Import],B000069U6C
Ensemble Stars! Deformed figure vol.5 TakashiSachiin EiSatoshi,B01N0CMC6C
Taito lottery Free! Eternal Summer Flower afternoon cookie-style rubber Charm Award Makoto Tachibana single item,B014KDYVY8
Power Shovel ni Norou!! [w/ controller] [Japan Import],B00005Q2VL
Taito Super Mario Maker Big Builder Mario Action Figure,B073VY7GZ1
Takeshi no Chousenjou (Takeshi's Challenge) Famicom (Japanese NES Import),B000068I2T
PS2 Giga Wing Generations Japanese Game,B00N0UHMT4
Taito lot of Honpo songs Prince-sama Maji LOVE1000% C Prize deformed figure Shinomiya Natsuki,B008IQL1WY
Taito 6.7 Kantai Collection: Kancolle: Mamiya Figure,B017EBPOMQ
Taito SAKU-SAKU Panda Oversized Huggy Stuffed Toy Soft Plush Japan Limited Goods,B07QGSTW3D
Taito Square Enix Dragon Quest Blue Slime Squishy Stress Ball Toy 7cm,B08GV198ZJ
Robotics;Notes Frau Koujiro Taito PVC Figure,B00C3O0LFU
Jet de Go! (PlayStation the Best) [Japan Import],B00005OUS5
Taito Shinobu Oshino Story Series Glass Coaster Set vol.2,B078PRYBK9
Darius Gaiden [Japan Import],B000069SCN
Taito Final Fantasy XIV: Wind-up Ifrit Minion Figure Volume 1,B01M3RE6AW
Taito 6 Free! -Eternal Summer-: Makoto Tachibana Figure Youth Ver.,B018ID43LM
Re:Zero Precious Figure REM China Maid Ver.,B08CKW5MQQ
Warrior Blade: Rastan vs. Barbarian [Japan Import],B00007LL9Z
Taito Dreams Come True Debut 30 Anniversary Dorikuma-Warukuma sit Big 2 Set Stuffed Soft Plush Doll Genuine,B07VXTVRLD
Taito Dragon Quest AM Big Slime & Doraki Slime Stuffed Soft Plush Doll Genuine,B074W5BP9T
Baka to Test to Tsu in! (Hideyoshi Kinoshita figure) B Award,B00P275CDG
Taito Great Writer Stray Dogs Ryunosuke Akutagawa Mascot Prize Stuffed Soft Plush Doll Genuine,B076HQNXYX
Taito 7 Kantai Collection: Kancolle: Teruzuki Otsukimi Figure,B01L8GFOEG
Taito Hatsune Miku Autumn ver. ~Renewal~,B08GM3197P
Taito Final Fantasy All Stars Moogle Handy Light| 6.3,B074DSF83L
Taito Great Writer Stray Dogs Nesoberi Stuffed vol.2 [Chuya Nakahara] Separately,B01KJBTSKW
Great writer Stray Dogs character badge can badge Atsushi Nakajima,B06XJCKWV6
Rainbow Islands Extra: The Story of Bubble Bobble [Japan Import],B000148KFC
Taito Final Fantasy XIV A Realm Topaz Carbuncle Carbuncle Room Lamp| 6.3,B081RRJSFP
Taito Baka to Test Tsu in! Himeji Mizuki & Minami Shimada Figure All Two Full Set + Poster with Bonus,B01KPI34OA
Taito Magic Show Series 8 Super Pochaco Action Figure with Black Bunny ears,B00OYHMGC0
Cooking Mama [Japan Import],B000E67SB4
Taito 6.7 Date A Live II: Kotori Itsuka Elohim Gibor Ver. Figure,B00PT3QQQA
Taito HARINEZUMI-NO-Azuki Hedgehog Oversized Stuffed Soft Plush 42cm vol.2 Cute,B07P5RJY7C
Taito Dragon Quest large stuffed toy baby Satan / Momon 43ãŽ stuffed 2set,B07XPW5YFG
Taito Final Fantasy XIV Koropokkuru Stuffed Plush Japan Limited Goods Kawaii,B07LDZZJP8
Taito lottery Honpo Guilty Crown I Award Clear File Set design C / Daryl Yang other two separately,B0089LJ3AK
Taito Hatsune Miku Figure 3rd Season Spring Version,B0871V7X7Z
Arkanoid DS [Japan Import],B000W6J4WW
Super Puzzle Bobble All Stars [Japan Import],B000087NBE
Taito lottery Honpo Queens Blade Rebellion G Award Big magnet [Anne Lotte & Shigyi],B01JSCQSII
Taito 5.9 Kantai Collection: Kancolle: Akashi Day Off Figure,B076JRJC7X
Sega Love Live! Sunshine!!: Riko Sakurauchi SPM Super Premium Figure,B01M0WV7G2
Taito Kirby of The Stars Friends Good Night Big Stuffed Soft Plush Waddle Dee,B07NPR78GG
Taito Dragon Quest humidifier Metal Slime Separately,B017M4A2ZY
Taito Persona 4 Arena Chie Satonaka 7.5 Action Figure,B00DRCN92E
Konata figure Taito Station Costume Ver.1 Lucky Star Lucky Star Taito from Kagami & all two set (japan import),B005OVIPGQ
The Jetsons: Invasion of the Planet Pirates,B00002SW2H
Taito Cardboard Big Action Figure vol.2 [B. Red Dumbo Over] (Single),B01AU7TRVA
Taito Dragon Quest AM Shiny Piggy Bank Mimic & Cannibox 2set 11cm Kawaii Cute,B07PYTMQD8
Final Fantasy XIV minion figures vol.3 [Krull] separately,B06XV9WRSN
Taito Fate/Extra: Last Encore: Saber Nero Claudius Figure,B07PLCKH5G
Taito Original Autumn Clothes 7 Hatsune Miku Action Figure (Renewal Version) (Sega Version),B07YV8SPSB
Taito lottery Honpo Ghost in the Shell: A Prize Motoko Kusanagi figure all one single item by Taito,B01LW88XY1
Taito Oniichan Dakedo A Isae Areba Kankei Naiyone Anastasia Nasuhara 6.5 Action Figure,B00DRCN7GW
Ensemble Stars notebook type Sumahokaba private YumenoSaki School,B01MA6GAM3
Final Fantasy XIV Minion Figure vol.3 Set of 4 Characters (Thancred| Titan| Krile| Nutkin),B06XV8GCQG
Taito lottery Free! Eternal Summer Iwatonbi deformed figures Prize Tachibana Makoto separately,B00VKJBSOW
Taito Dragon Quest AM mesh Type Donut Shaped Cushion Slime DQ Kawaii Japan,B07D8TCN7S
Taito Rani VIII: 18cm Jamma Prize Statue Figurine Bundled with 1 A.C.G. Trading Card (451071600),B08GL4TN63
THE Figure of Railroad Crossing Illuminate!&ring!,B013OGBQ3Q
Ensemble Stars! Mugyu' and mascot Trickstar Yuki true single item (prize),B07D71PT7L
taito Super Mario large Plush Toy - Yoshi Green,B00WMOA2EG
TAITO Kubrick KUBRICK Devilman all 10 species set,B01FQAHU7E
Taito Chakkusu GP Hatsune Miku Type General Purpose Rabbit Mascot Gray 11cm Stuffed Soft Plush Doll Genuine,B00OVSQ2EU
Taito Dragon Quest AM Okina Glitter stuffed Soft plush 35cm Slime Santa Version,B07ZMFF543
Taito 7 Kantai Collection: Kancolle: Yamashiro Figure,B01N4NMMZK
Taito White cat Project Oversized Star Raccoon Motchi Ri ~ Stuffed Soft Plush Doll Genuine,B06XZ3H2ZG
Densha de Go! Professional 2 (Taito Best) [Japan Import],B00028EW72
Re:Zero Rem~Room wear ver~| Multiple Colors (T83203),B08GKWZCR3
Taito 7 Hatsune Miku Birthday 2019 Action Figure (Taito Online Crane Version),B07YPFYWTV
Mayoi Hachikuji Bakemonogatari Figure,B005DKGRKY
Taito 6.7 Kantai Collection: Kancolle: Northern Princess Major Damage Figure,B01CB720M0
Taito lottery Honpo Little Busters! F Award Big cans badge Saegusa Haruka Kei Kurugaya Yuiko,B00I24QGV8
Taito lottery Honpo Key D Award keyboard cover [Little Busters! Haruka Saegusa Ver.] Separately [Taito],B00XVI443M
Taito Lottery Honpo Free! Square Porch Award Iwatonbi high School Swimming Club Separately,B00GOSOO7C
Taito Galaxy Express 999 Movie Super Mechanics 999 No.,B001QWJCK0
Taito Granblue Fantasy: Narmaya Figure,B01NA7P1T9
Taito Final Fantasy XIV A Realm Tonberry Figure Room Lamp Light Extra Color| 5.5,B01N5LS5N6
Taito Re:Zero -Starting Life in Another World- - Rem - Precious Figure - Jumper Swimsuit ver,B086STNQFP
Taito 6.7 Kantai Collection: Kancolle: Isokaze Figure,B01KU8U0T2
Taito lottery Honpo DC Da Capo G award rubber key chain further (japan import),B00FADV1ZK
Space Invaders [Japan Import],B000092PK6
Taito 7 Hatsune Miku Winter Live Kagamine Rin Action Figure,B07ZMZWKX9
Taito Mamama Style Api 8 Hatsune Miku Action Figure,B0131E2OC8
Taito lottery ensemble Stars! INSIDE collection bottle Award Valkyrie single item,B01N1QGF9E
Taito Inu X Boku SS Shirakiin Ririchiyo PVC Figure Lab Coat Ver,B00E9JIMVM
The Jetsons - Nintendo NES,B00004SVR0
Taito Re: Zero -Starting Life in Another World-: Rem Precious Figure (T-shirt Swimsuit Version),B07T2WX1Q9
Taito Dragon Quest AM Soft Motchiri Stuffed Soft Plush 40cm Slime Beth Kawaii,B078H82XS8
Taito Fate Stay Night Saber Prize Taito Premium Action 7 Figure,B00BRGXP12
Bakemonogatari Real Figure Vol.2 whole set of 2 [Toy],B0041GN7P4
Taito 7 Kantai Collection: Kancolle: Tokitsukaze Figure,B06XZLKWXQ
Taito Poinko Mini Puppet (Brother & Brother) Set,B01M3Y3S6K
Persona 4 mini kid Figure vol.2 Kanji Tatsumi| white bell-Naoto Kuji Lycee bear all four sets (japan import),B00AHTP7CU
Operation Wolf,B00004SVSU
Taito Final Fantasy XIV Inflatable Vinyl Carbuncle (Topaz)| 17.7,B07GMMRYT4
Persona 4 Arena P-1 Grand Prix competition goodwill Kirijo Mitsuru| Akihiko Sanada (single),B00C65UG24
Taito Hatsune Miku Birthday 2019 Ver. Figure Vocaloid 7.1 [Japan Import],B07WPQBW72
Taito Final Fantasy All Stars Deformed 6 Plush Doll Vol.3 Squall Leonhart,B01NBW76DR
Taito Final Fantasy All Stars Deformed Stuffed vol.7 Zidane Separately,B06XVBLRJC
Taito Final Fantasy Pocket Watch 7 Set Complete Japan Limited,B07DC8ZT4R
Rastan Saga II [Japan Import],B0000ZPULE
Starry Sky earphone jack Metal Charm Kazuki Shiranui single item Starry Sky Charm earphone jack TAITO TAITO,B00T2IUIVM
