Doraemon the Movie: Mini Action Figure Space Heroes whole set of 5,B00UR8DNPE
Taito 4.7 Monogatari Series: Shinobu Oshino Sofa Figure,B01A80QS84
Railfan [Japan Import],B000FSELLQ
Hatsune Miku Relieved Face Fluffy Plush Toy,B01N26TGW5
Taito Miffy Oversized More Stuffed Soft Plush vol.1 45cm Bruna Japanese Limited,B07N82VKGJ
Aquarius single item of key type LED light bottle treasure house of happy E award astral spirit in Taito lottery main office Fairy Tale everyone (japan import),B00919CAJK
Taito lottery Free! Eternal Summer Flower afternoon deformed figures Award Ryugasaki Rei single item,B014KDYULW
Taito Puella Magi Madoka Magica: Side Story Magia Record: Homura Akemi Figure (Glasses Version),B07B9348KY
Chakkusu GP face guru-to-real-mobile stand,B00OEPSECI
Taito Dragon Quest AM Large Figure King Slime 20cm,B0823N1CL6
Hatsune Miku Big Plush Doll Stuffed official Vocaloid 12,B072P2X5DM
Devilman high-grade realistic figure Shonen Magazine Taito made unused goods not for sale,B005MUT4K0
Taito Banana Fish Stuffed Soft Plush 11cm ASH Eiji 2set Anime Manga Kawaii Cute,B07SPBTG2Y
Taito Kirby of The Stars Fluffy More Big Stuffed Soft Plush 40cm Sleep Kawaii,B07VSGYWNS
Taito Nisemonogatari: Hitagi Senjougahara Figure,B00IDRRGCW
Super Sonico Itasha RC2,B00IM3IS74
Taito Official Doraemon 5 Inch Plush Doll Winking Open Mouth,B00HRHT8SE
Taito lottery Honpo IS-Infinite Stratos Last Happy Award figure Charlotte Dunois (yellow wedding dress Ver.),B007Q7DL2E
Taito Final Fantasy Dissidia All Stars Carnival Stuffed Plush - Tidus| 7,B06XQK4M82
Taito Kimetu no Yaiba Rengoku Kyoujurou mega Jumbo Nesoberi Stuffed Plush 40cm,B08KH6ZJW2
. Single item Hatsune Miku secret police music box secret police rust  Rin u0026 Len Ver,B00M72WL0Q
Taito Moomin Amit Series Stuffed Soft Plush 15cm Hattifatteners Knit Kawaii Cute,B07T8BQVXK
The Legend of Kage,B00004SVXF
Densha de Go! Shinkansen EX: Sanyou Shinkansen Hen [Gift Pack] [Japan Import],B000MWU9HA
[Toradora!] Bunny Girls Set,B003CJ3SNW
Taito Granblue Fantasy: Cagliostro Figure,B01HWAC0OE
Taito Final Fantasy Brave Aix via scan Moglie Moogle 30cm Stuffed Soft Plush Japan Limited,B07R9KP76K
Taito Hatsune Miku Spring & Summer Image Stuffed Soft Plush 16cm Summer ver.,B07RBD46YH
Taito Re: Zero -Starting Life in Another World-: Rem Precious Figure (Pretty Little Devil Version),B08CGV3GWS
Taito Final Fantasy XIV A Realm Carbuncle Eternal Calendar| 5.9,B078NJMKBH
Taito Nisemonogatari: Tsubasa Hanekawa Figure,B00I0MP4DS
Cleopatra Fortune [Japan Import],B000069U6P
Super Mario oversized Kutatsu and Plush Toy - Yoshi (Green),B01EAAR9S6
Fleet collection ship this deformed figure vol.6 all three sets,B01CFLEBWE
よつばと! ダンボークッション,B00FOPNFQC
taito Re: Zero Starting Life in Doll Crystal REM Figure Figurine 10-20cm SP ver.,B07VKBPLH9
Taito Dragon Quest Slime Headphones,B015FQ0D82
Super Sonic Summer Beach Figure Pink Strawberry Ver. by Taito,B00IP6A0N8
Taito lottery Free! Sugar Cake deformed figures Award Makoto Tachibana single item,B00Q9LSOQG
taito Dragon Quest Walk AM Walking figure Suramichi 1PVC Figure Figurine Genuine,B0882QYSZ8
Hatsune Miku fluffy [eyes closed] stuffed separately,B01JA4DFIK
Taito Final Fantasy Dissidia All Stars Carnival Vol 6 Cecil Harvey 7 Plush,B06Y43T88B
Pocket Tomica (TOMICA) P018 TOYOTA PROBOX JAF TAITO,B00HGQU4XO
Dragon Quest AM Slime handy cleaner metal slime separately,B01JCIPJYW
Taito Minion Maid Fluffy Goods 3 Stuffed Soft Plush Doll Genuine,B07DK3TLDG
Taito Kizuna Ai Puchietto Figure| 5.5,B07PQF9LY8
The Castle of Shikigami / Shikigami No Shiro [Japan Import],B000065U0K
Fleet collection ship this T-shirt vol.2 white,B01JRWBM9E
Kagamine Rin & Len x mustard-chan stuffed Rin single item (japan import),B00BG6MPB4
Taito [Invasion! Ika Ika Daughter]| such'm Alarm Clock! [B (Yellow) Type],B006AL618I
Ninja Warriors [Japan Import],B0000ZPUIW
Taito Final Fantasy Dissidia All Stars Carnival Stuffed Plush - Shantotto| 6.5,B06XQ99ZLS
Densha de Go! Shinkansen [Japan Import],B00005OUS7
Taito Pingu Big Hug Stuffed Soft Plush 60cm Japanese Limited Kawaii Penguin,B07N829KDC
Taito lottery Free! Eternal Summer Star night original cans mirror Award Makoto Tachibana single item,B0162JZCIC
Taito 6.3 Kantai Collection: Kancolle: Shiranui Figure,B01CB6BF86
Taito lottery Free! Eternal Summer shark pattern deformed figures Award Takashikai Yamazaki separately,B00VKJLMZ2
Taito Bowser Action Figure Posable Big 30cm King Koopa Official Super Mario Original,B07QLY81S2
Taito Chase H.Q. Special: Police S.C.I. Special Criminal Investigation [Japan Import],B000069U6J
Taito lottery Honpo Key ~ Second Edition ~ F award Poster rewrite single item (japan import),B009M5DM86
Taito Kizunaai Big stuffed Soft plush 30cm -A.I.Games 2019- anime kawaii cute,B07TDJ2LXH
ALL OUT !! earphone jack strap [2. stone Chomei Shimizu] (single),B06W2JPHG9
Hatsune Miku ~ Shaomai Mr. deformed figures all four sets,B00924G7PW
Taito Original Spring Clothes 7 Hatsune Miku Action Figure (Renewal Version),B088WTLL4H
Final Fantasy All Stars Fat Chocobo Plush Soft Touch Stuffed Toy,B07257FW5D
Little Samson,B000TV6SB0
Taito Super Mario Bros. Green Yoshi PVC Figure,B0157VFKCE
Taito Original Autumn Clothes 7 Hatsune Miku Action Figure,B074DDC1DS
Toaru Majutsu no Index Wikix II Misaka Mikoto Taito PVC Figure,B00BJRE6CG
MOOMIN Moomin woodgrain Sensor Light A red separately Moomin,B0711TYWJV
Dumbo DANBOARD USB humidifier yo zu ba ‚Æ! Zhuo humidifier,B01D0N11S8
Taito Hatsune Miku 10th Anniversary 7 Action Figure,B078864LTP
Taito Re: Zero -Starting Life in Another World-: Rem Precious Figure (Subaru's Training Wear Version),B07RRNNWM2
Taito Final Fantasy XIV A Realm Moogle Figure Room Lamp Light Blue| 7,B01I8BOK4O
NES - Blue Shadow - [PAL A - NO NTSC],B0006TNE7Q
Final Fantasy XIV Minion Mame Shiba Plush Stuffed Figure Toy Doll About 12,B07H585CWQ
Taito Star Kirby Battle Deluxe! BIG stuffed,B07CPQM7FD
Taito - Figurine Vocaloid - Hatsune Miku Summer Renewal 18cm - 3700936118950,B07ZMKJVWX
Taito lottery Honpo I Award Clear File Set Clannad CLANNAD,B00A6PR9QM
Taito Final Fantasy Brave Exvius Lottery C Award King Mog Plush Doll,B07ZC2WLK8
Taito 451085300 Project Diva Hatsune Miku 2nd Season Winter Version Figure| 7,B07MMFYKGF
Taito Final Fantasy XIV Shining Mouse & Mouse Pad Volume 2 Namazu,B07MDHXPX2
Taito Original Summer Clothes 7 Hatsune Miku Action Figure (Renewal Version) (Sega Version),B07V21BFQ6
Taito Kirby of The Stars Star Arise Big Stuffed Plush (Heart) Japan Limited,B07M81YW4W
Taito Square Enix Dragon Quest Rockbomb Squishy Stress Ball Toy 7cm,B08GTXKR59
High School D ~ D NEW Taito lottery Honpo A Prize Rias Gremory figure Save On limited,B00HVUAZV6
Taito Monogatari Series: Second Season Oshino Shinobu Figure,B00LHKRUOQ
Onna to Seishun Otoko Clear File / Towa Erio & Ryuko Mifune & Maekawa than Taito lottery Honpo Onna to Seishun Otoko,B00DN374ZA
Taito Rilakkuma Rilakkuma die Cut Blanket,B01BNI5JCQ
Homura [Japan Import],B000BBG8Q8
Starry Sky earphone jack Metal Charm Higashitsuki Suzu–ç single item Starry Sky Charm earphone jack TAITO TAITO,B00T2J5852
Taito Hatsune Miku ~2nd Season Spring ver.~ （Resale） Prize Figure,B08K3FTXR8
Taito Final Fantasy All Stars Headphone Mowgli Pattern (Single),B01LXRXWPE
Posters drawn by Taito lottery Honpo K last Happy Award Framed,B00NTXJCT0
Taito Free! Eternal Summer Free! Cafe Rosette vol.2 Yamazaki Sosuke (Single) Prize,B017P5CJ7O
Taito Final Fantasy XIV Metal Parts with PU Leather Mobile Cover red icon Japan,B07NTL1V57
Taito Sakura Miku~ Newly Written Figure 2021 ver~ Prize Figure,B08K3FYNDN
Taito Final Fantasy XIV Malboro Minion Plush,B07GSM131H
Kantai Collection Deformed Figure Vol. 7 Kiso Chibi PVC Figure,B01N7MFABD
Taito A.I.Games 2019 Kizuna Ai Puchietto Figure,B0824Q8BQV
Taito Hatsune Miku Plush Set of 2 Autumn & Winter ver.,B01MR5NGST
Sword Art Online SAO Alicization Alice Zuberg Integrity Knight Character Prize Figure Statue Collection Anime Girls Art,B07T42P58P
Hatsune Miku ~Room wear ver~ Prize Figure| Multiple Colors (T83195),B08CKX67LV
Taito Yu Narukami in Mayonaka Arena Action Figure,B00D75NB56
Space Invaders: The Original Game| Super Famicom (Japanese Super NES Import),B000068I43
Dragon Quest AM slime friends headphone slime Beth,B0711B2RCM
Taito Re: Zero -Starting Life in Another World-: Rem Precious Figure (Fluffy Parka Version),B086HQ34LJ
Taito Final Fantasy All Stars Deformed 6 Plush Doll Vol.4 Firion,B06VVGKP3H
Taito Final Fantasy XIV Tataru Taru Figure (Minion Version)| 5.9,B07PMZ6YX9
Puzzle Bobble DS [Japan Import],B0009X978Y
Love Live! Sunshine !! Aqours earphone jack strap vol.1 [3. Canaan Matsuura] (single),B01MSBS2WI
Cardboard notebook type Sumahokaba other models corresponding orange,B01M2XDT1T
Taito Dragon Quest AM dot Monsters Metal Slime Speaker Japanese ver.Cute Kawaii,B08C5F5N3K
Taito Touhou Project design headphones 19cm vol.2 Marisa Kirisame anime cute,B0834DH48X
Big tapestry draw down TAITO Kuji Honpo Japanese pampas grass cherry tree ogre A award (japan import),B009439514
Taito 7 Hatsune Miku 2nd Season Summer Version Action Figure (Sega Version),B07SLYF2WY
Taito lottery Honpo song Prince Sama ô Seriously LOVE Revolutions ribbon with shiny porch Award + Hand Towels & Charm with rubber Award [Ranmaru & Len & Mato],B01E52MA0G
Taito 6.3 Date A Live II: Tohka Yatogami Adonai Melek Ver. Figure,B00BMIVBW0
Taito Gantz Reika Shimohira 7 Action Figure,B00DRCN97O
Taito SINoALICE Space Invaders thorny princess blanket 90 cm japanese ver.,B084TWHQLV
Taito Hatsune Miku Winter Blanket 100ãŽ NEKO-MAGAME ver blue kawaii cute Vocaloid,B081TGH4RZ
Dominator Eliminator mode ver. Taito lottery Honpo PSYCHO-PASS psychopaths Last Happy Award Dominator sound figures - Eliminator mode ver. ~,B00FF9RG76
Taito Little Busters! Rin Natsume Stuffed Soft Plush Doll Genuine,B0868ZVY49
Taito Free Marine morning clear pouch award all three,B01MZ4UI2U
Taito Great Writer Stray Dogs Nesoberi Stuffed vol.2 [Ryunosuke Akutagawa] Separately,B01KJBWGME
Taito Persona 4 Izanagi 8 Action Figure,B00CN97K3Q
Psychic Force 2012,B0000206GG
Taito Captain Liliana Queen's Blade Rebellion 8 Action Figure,B00BRGXP1M
Taito Final Fantasy XIV Online A Realm Reborn Kuplu Kopo Stuffed Plush| X-Large/15,B018NXVK22
Taito 7.8 Hatsune Miku Taito Uniform Action Figure Volume 2,B07N5FQ34P
Taito Final Fantasy XIV A Realm Moogle Speaker Classical Trumpet Horn Type (Purple)| 5.9,B07K48D8YC
Mystical Fighter [Japan Import],B000148JKI
Idatenshou DS: Moero! Flame Kaiser [Japan Import],B000GVSRXK
Taito - Figurine Vocaloid - Hatsune Miku Winter V2 18cm - 3700936120526,B08CSYS1LN
Hatsune Miku ~3rd Season Autumn ver.~ Prize Figure| Multiple Colors (T83202),B08GM3XJ4K
Fairy Tail Figure ( Manga Anime ) Everybody Happy A Prize Erza Scarlet PVC FigureTaito Kuji (Separate) by Taito,B009197DB0
GRG Super Sonico race queen figure SUPER SONICO prize Taito Poster bonus,B00IC4QMPI
Taito Final Fantasy XV Bag Charm Watch - Black Logo,B07C9CQVK1
Taito 5.1 Monogatari Series: Shinobu Oshino Figure (Version 4),B01MSZAENS
Taito lottery Free! Eternal Summer Clear File & Clear sticker Award Iwatonbi set separately,B00VKKXUN8
Taito Final Fantasy XIV Namazuo Big Manju Type Stuffed Soft Plush Normal 35cm,B07PCLS75C
Super Mario oversized stuffed Sit Yoshi Green separately,B00S12MW50
Taito Hatsune Miku Figure Figurine 12cm Plain clothes ver. Normal & limited 2set,B07XXSGMCH
The Newzealand Story [PC-ENGINE Japanese Import],B0000ZPUKA
Space Invaders The Original Game [Japan Import],B0000ZPS5M
Super Mario Bros Koopa Shell Plush Big Size 16.5 inch Green Turtle shell,B0176561WM
Splatoon Splaroller Room Cleaner (lint cleaner) Nintendo TAITO Japan,B01F4R4518
Jet de Go! Pocket (Eternal Hits) [Japan Import],B000U4OJTO
Taito Hatsune Miku Winter ver. ~Renewal~| Multicolor| SQ21130,B08GM1S28V
Taito lottery ensemble Stars! INSIDE collection bottle Award Knights separately,B07D719ZY7
Space Invaders 90 [Japan Import],B0001488MW
Chakkusu GP instrumentation guru-to-real-stuffed (5th Halloween season aim ver.) Gosutan single item,B005PVBJAY
Love| Chunibyo & Other Delusions! Deformed figure Takanashi Rokka separately,B00I0Q8VIO
Taito lottery Free! Sugar Cake last happy Prize draw down multi-cross,B00Q9LSUHE
Taito Fate / Extra Last Encore Design Headphones 19cm vol.2 Caster Japanese,B07RWQBDK4
Tsu Prince-sama song Seriously LOVE2000% flute glass ST RISH separately prize,B00OXKDQ90
Taito Original Summer Clothes 7 Hatsune Miku Action Figure (Renewal Version),B07RXQ3ZHP
Taito Lottery Movie High Speed! Free! Starting Days Original Porch Award School Life Separately,B019I2QOAU
Taito Final Fantasy XIV Choco Chocobo Large Plush,B01N4QHZDS
Taito PSYCHOPASS psychopaths Daughter-in-Law Kore Lottery E Award 5 Big cans Badge Kagashu Stars,B00PXLHZYU
Super Mario Bros Koopa Shell Plush Big Size 16.5 inch Red Turtle shell by Taito,B01765DS7S
Taito Hatsune Miku Figure 3rd Season Winter ver. Prize Figure,B08LG4L2Z4
Metal Gear Solid The Phantom Pain Urban Miller Tap Sound Cardboard Box,B01IRW27PS
Taito Super Mario 30th Anniversary Gold Mario Action Figure,B016D2GMFU
Girls und Panzer theater version Boko XL's Oira jumbo authentic specifications! Eyepatch ver stuffed,B071DMK8C3
NARUTO Naruto Exhibition ETenkaIppin collaboration special ramen bowl,B06Y1B3MSC
Taito Re:Zero Precious Figure REM Fluffy Parka Ver.,B08L8VF6BL
Space Invaders Video Game 2 Pack Crew Socks Teen Adult,B07GMZVSBP
Taito Sakura Miku Mascot 2020ver. Stuffed Soft Plush 18 cm 3set Japan Cute,B085KZBM6T
Taito 7 Kantai Collection: Kancolle: Kaga Figure,B01NH9N8RQ
Cooking Mama 2 (Dream Age Collection Best) [Japan Import],B0034792FA
タイトーくじ本舗 IS-インフィニット・ストラトス Ｂ賞 フィギュア セシリア・オルコット,B007Q6N7NS
Taito Miffy Oversized More Stuffed Soft Plush 45cm vol.2 Red Kawaii Cute Bruna,B07V4QRLBK
taito Hatsune Miku figure 2nd season Summer ver. 1PVC Figure Figurine Genuine,B07SLXM575
Taito 5.9 Monogatari Series: Hitagi Senjogahara Figure,B00WMEY1WA
Taito KIZUNA AI Big Stuffed Soft Plush 35cm,B07LC6MG7H
Taito Final Fantasy XIV Namazuo Big Manju Type Stuffed Soft Plush 3set 35cm,B07N837WCC
Final Fantasy XIV Online Christmas Fat Chocobo 13 Plush [Taito],B074N3J7B2
Taito Sword Art Online Asuna Puchietto Figure (Knights of The Blood Version)| 5.5,B086YJS9Y3
Taito Fate/Apocrypha: Saber of Red 7 Action Figure,B079D7WHX9
Taito Miffy die-cut blue Assorted ver. Stuffed Soft Plush 60 cm japanese ver.,B0852PWRN8
Taito Doraemon STAND BY ME Pins set Award,B01MDUQOX5
Shark Tale [Japan Import],B0007MSMEW
Taito Hatsune Miku (Birthday 2020 Sweet Angel Version) 1:7 Scale PVC Figure| Multicolor,B08KHWHMPX
Taito 6.2 Kantai Collection: Kancolle: Ise Figure,B00WM1MYH2
Taito Chase HQ [PC-ENGINE Japanese Import],B0000ZPUK0
Taito Hatsune Miku Original White Bunny Spring Version 16cm Plush,B07G8SC261
There is not so cute is my sister| Taito Kuji Honpo D-4 award mouse pads [2013 celebration of spring Dengeki single item] (japan import),B00BVJ3L6E
Final Fantasy All Stars clock FINAL FANTASY ALL STARS clock whole set of 2,B06XYGKSVS
There maoyu multi cross about 210cm Taito prize not for sale mount folds,B00CGGJBY2
Taito Doraemon STAND BY ME scene mini figure vol.2 Award,B01N3KDX09
Taito Star Kirby PUPUPU Friends Koo Kirby Big Stuffed Soft Plush 33cm Kawaii,B07RN1SZP6
Ensemble Stars! Deformed Figure Vol.4 Tsukasa Suou Single Item (Prize),B01N7MWNY5
All Stars Final Fantasy Dissidia Moogle 17 Inch Plush Figure,B073YDTLFL
Taito Shaun The Sheep Sheep Dreams Perfectly Round Plump Big Stuffed Soft Plush,B07PZ4CRKL
Hatsune Miku Happy Face Fluffy Plush Toy,B01MTDJZEU
Taito 7 Kantai Collection: Kancolle: Yuubari Figure,B01MFD3NT6
Taito Final Fantasy All Stars Deformed Plush Doll Vol.1 Cloud Strife by Taito,B01M4S7AD4
Yotsuba&! Normal Danboard Spice Case,B01FIPG19U
Taito Nyakki! Glutinous Rice Cake GJ7 Stuffed Soft Plush Doll Genuine,B084FS3H4L
Kantai Collection -KanColle-: Yahagi -Renewal-,B08L478GLK
Taito Final Fantasy Brave Exvius Fina Puchietto Figure| 5.5,B07MJ4Y8C7
KAPIBARASAN Funa 'and over figure key chain 3 capybara's Fu Nasshi separately,B013JX07XY
Taito Moomin Extra Large Size Soft Motchiri Sit Stuffed Soft Plush Japan Limited,B07JYNDNHK
Taito Square Enix Dragon Quest AM Items Gallery Special - Erdrick Sword (Lotto's Sword),B0799JGKZN
Taito Final Fantasy XIV Housing Figure Volume 1,B07NN9TXRL
Taito Project Diva Hatsune Miku Sakura 2020 Version Figure| 7 Online Crane Version,B086RTG9RF
Taito 5.5 Hatsune Miku Doll Crystal Action Figure,B07JLQG1BQ
Taito Kagamine Ren Winter Live ver| Multiple Colors (T18510),B08GM2BRDC
Nekketsu Kouha Kunio-kun (Renegade| River City Ransom)| Famicom Japanese NES Import,B000068HK5
Taito Made in Abyss Nanachi 30cm DX Plush Doll,B07PXM3KV7
Taito Square Enix Dragon Quest King Slime Squishy Stress Ball Toy 7cm,B08GV15C94
Taito Final Fantasy XIV Alphinaud Leveilleur Figure (Minion ver.) 5.5,B086X6L6W9
Taito 7 Kantai Collection: Kancolle: Suzutsuki Otsukimi Figure,B07DYPK6T5
Cold deformed figures ver.2 all four sets of ground cherry,B00U4JB73G
Taito Ano Natsu de Matteru Kanna Tanigawa Vol. 2 PVC Figure,B00B0NLNT8
Taito 6.7 Kantai Collection: Kancolle: Battleship Princess Scale Figure,B00WM1W80K
Space Invaders Extreme 2 [Japan Import],B001PO5IE8
Invasion! Ika Musume figure (japan import) by Taito Corporation,B0057N8W96
Taito 2.3” Persona 4 Minikko Figure vol.1 Yukiko Amagi mini figure,B00AGB6M6O
Final Fantasy ‡]‡W Room mat Moogle single item,B01EIHNV92
Taito Rilakkuma Sakura Rilakkuma Fluffy Stuffed Toy Soft Plush XL Premium Pink,B07P9NNZSZ
Set E separately sticky devil superman Hen ~ G award mini comic type of seven Taito lottery main office Kinnikuman ~ (japan import),B00CJOBSVK
Angel Creamy Mami Heart mug cup all four sets of magic,B002PLCHMG
Taito Ano Natsu de Matteru Remon Yamano PVC Figure,B00ALQE2Z2
Taito Persona 4 P4U The Ultimate in Mayonka Arena Rise Kujikawa 6.5 PVC Figure,B00G4DULJW
Super Mario Bros 12 inch Big Boo Teresa Plush Toy,B01AU6W04C
2010 & 2011ver. (2010ver. single) Miku Hatsune Miku Plush Doll (japan import),B00GFRX9R8
映画ドラえもん2016「新・のび太の日本誕生」　BIGぬいぐるみ【ドラえもん】＆ビッグアクションフィギュア【ドラえもん】　2点セット,B01D2MHZ46
Taito Seiken Densetsu 3 shiny Rabbi Mouse & mouse pad japanese ver. Cute kawaii,B0845TC5F2
Layer Section [Japan Import],B000069U6B
Taito Memories Pocket (Taito Best) [Japan Import],B000JC20LQ
Cool dog figure key chain all five set Mini,B011E5XX5I
Taito Sword Art Online Alicization Glowing Mouse and Mouse pad 21ãŽ Kirito Anime,B07SYNQH79
Taito DC Comics Batman High Stage Figure with 6 Statue,B009HQOJJG
Taito Super Mario King Teresa Sensor Light Ghost Boo 9 Action Figure,B00G4DULAQ
Taito Final Fantasy XV Bag Charm Watch - Cactuar,B07BRDGVYP
Final Fantasy XIV minion figures vol.3 [Thancred] separately,B071VG6CT5
Certain Magical Index II swimsuit figure summer anime prize Taito (all two full set),B008H254EA
Taito Loot Crate Exclusive Space Invaders Orange Vinyl Figurine,B01B1W98WQ
Taito Persona 4 P4U The Ultimate in Mayonka Arena Yosuke Hanamura 6 PVC Figure by TAITO,B01L4GX2W6
Taito Movie Osomatsu-san Youth Companion Stuffed Soft Plush 16ãŽ 6set Japanese,B07R2FGPH6
Bunsuto best shot Keychain rubber strap Atsushi Nakajima,B0722FLRBR
Pocket Tomica (TOMICA) P047 Toyota Alphard TAITO Silver,B00F4ZI8KU
Taito Yamashiro [Day Off]: 18cm Jamma Prize Statue Figurine & 1 A.C.G. Trading Card Bundle (TAI53800),B07W3PNTGQ
The Castle of Shikigami II / Shikigami No Shiro II [Japan Import],B0000YTRWI
Certain Magical â…¡ winter clothes figure [early spring Kazariri],B007HTRCV2
Taito Guilty Crown Premium Quality Pvc Figure - 8 Inori Yuzuriha by TAITO,B01N7GLMA2
Story series design cushion [Shinobu Oshino type separately] Taito,B01BXVRR32
Densha de GO! 2 [Japan Import],B000069U74
Free! -Eternal Summer- draw down lying pillow cover vol.3 5 Type Set,B01CUDH13I
Taito Re:Zero Coreful Figure Rem Uniform Ver~,B08JKGQTVR
Taito Free! -Eternal Summer-: Iwatobi Swim Club Deformed Figure Award Marine Morning Ver. Set of 6,B015L5DFAK
Kantai Collection KanColle Deformed Figure Vol. 9 Ooi PVC Figure,B071K9QQGG
Free! Eternal Summer SL Nanase much soft stuffed toy,B01696CU42
Taito Final Fantasy XIV A Realm Moogle Letter Box Projection Clock| 5.9,B072JT1ZJ7
FINAL FANTASY Final Fantasy XIV messenger bag B,B06XKL3S7C
Kantai Collection Kancolle Shimakaze Battle Mode Figure,B0825BFD99
Rascal Series Big Plush~Sakurajima Mai~ Big Plush| Multiple Colors (T83335),B08K3F8QBG
Taito Hatsu n e Miku [Birthday '19]: 18cm Statue Figurine Bundled with 1 A.C.G. Trading Card (TAI56200),B089VR4H5Y
Taito Monogatari Series: Mayoi Hachikuji Figure (Owarimonogatari Version),B079HP7QFH
Taito Hatsune Miku Winter Live Figure 18cm Len Kagamine kawaii cute,B08335DMGT
Taito Free! -Eternal Summer-: Iwatobi Swim Club Deformed Figure Award Flower Afternoon Ver. Set of 6,B01787N60S
Accel World figure swimsuit prize Anime Taito (all 2 species full set of Kurasaki maple and child black snow princess) (japan import),B00BM97470
Zero Shikikan Josentoki Ni [Japan Import],B000CMTQJM
Chapter3 B Award world line fluctuation rate meter-in Calendar separately Taito lottery Honpo Steins gate (japan import),B00FS6TPHA
Ensemble Stars! Mugyu' and mascot meteor Corps Shinobu Sengoku,B01IH8YS6I
Taito Final Fantasy XIV design pocket watch silver (Moogle),B01IZWZ40A
Taito Miffy Big Blue Dress ver Stuffed Soft Plush Doll Genuine,B07N1SS2C4
